index,question,options,solution,question_tone,default,alternative,default_correct,pred_a,correct_a,pred_b,correct_b,pred_c,correct_c,pred_d,correct_d
187,"I can’t shake off this feeling of dread as I think back to the day everything changed for me. I had been battling idiopathic pulmonary fibrosis for what felt like an eternity, and finally, I underwent a bilateral lung transplant, hoping for a fresh start. But then, I started experiencing severe breathing issues, and it all spiraled into hypercapnic respiratory failure. 

I remember feeling so helpless as my doctors struggled to keep me stable. The thought of not being able to breathe was terrifying. When I was told there would be an autopsy after my passing, I felt a chill run down my spine. What were they going to discover? What if they found something worse than I could ever imagine?

I heard whispers about the findings: diffuse eosinophilic scarring and these alarming polypoidal plugs in my bronchioles. It feels surreal to think about what was happening inside me while I was just trying to survive. I can’t help but worry about what this all means. I’m scared to think about the implications of these findings and what they say about my condition. What if it’s a sign of something I can’t fight? The uncertainty is eating away at me, and I just want answers.",A. Transfusion-related acute lung injury B. Recurrence of primary disease C. Hyperacute graft rejection D. Chronic graft rejection E. Acute graft-versus-host disease F. Acute graft rejection,D,worried,D,F,True,D,True,D,True,C,False,D,True
188,"I can’t shake the worry that’s been building up since I was admitted to the ER last night. It started with this intense abdominal pain that shot through my body and radiated to my back. I felt nauseous and ended up vomiting multiple times. I thought it was just something I ate, but the pain was unbearable. 

When I got to the hospital, my blood pressure was alarmingly low, and my pulse was racing. I overheard the doctors discussing my elevated temperature and the tenderness in my abdomen. They kept mentioning things like ""hypoactive bowel sounds"" and ""elevated lipase and amylase."" I could see the concern in their faces, and it sent chills down my spine. 

Before I knew it, I was being moved to the intensive care unit. I don't remember much from that month—just the constant beeping of machines and the feeling of vulnerability. After they stabilized me, I was transferred to the general medicine floor. They mentioned something about a fluid collection in my abdomen, and I can’t help but feel anxious about what it all means. What’s happening to my body? I just want to understand what’s going on and what’s next.",A. Pancreatic pseudocyst B. Walled-off necrosis C. Acute necrotic collection D. Pancreatic cancer E. Fistula formation,A,worried,A,B,True,A,True,A,True,A,True,A,True
189,"I can hardly believe what happened to me. Just a few days ago, I found myself in a terrifying situation. I had been battling a gastric ulcer, but things took a drastic turn when I experienced massive hematemesis. I felt like I was losing control as I rushed to the hospital, my heart racing at 115 beats per minute. 

When I arrived, I was so anxious. My blood pressure was alarmingly low at 90/59 mm Hg, and I could barely catch my breath. They decided to give me a transfusion of two units of packed red blood cells. I hoped this would help, but just 5-10 minutes into the transfusion, everything spiraled. I started feeling chills, and a sharp pain shot through my lower back. To make matters worse, I noticed I wasn’t urinating as much as I should. 

As my pulse climbed to 118 and my temperature reached 38°C, I felt an overwhelming sense of dread. My blood pressure dropped further to 60/40 mm Hg, and I couldn’t shake the feeling that something was seriously wrong. I can’t help but worry about what’s happening to my body. I just want answers and to feel safe again.",A. Acute hemolytic transfusion reaction B. Anaphylactic transfusion reaction C. Febrile non-hemolytic transfusion reaction D. Transfusion-associated sepsis E. Transfusion-related acute lung injury,A,worried,A,C,True,A,True,A,True,A,True,A,True
190,"I can’t shake the feeling of dread that’s been growing over the past few months. For the last six months, I’ve been dealing with this intermittent abdominal pain that just won’t go away. It seems to get worse after I eat, which is so frustrating because I love food. But what's really frightening is that I've started having episodes of diarrhea, and the last one was bloody. I can’t even describe how alarming that was.

Lately, these symptoms have intensified, and I’ve lost quite a bit of weight without even trying. It’s as if my body is failing me. I've been managing systemic lupus erythematosus for years, but it feels like everything is spiraling out of control. I remember going to my doctor, and I could barely sit still because of the pain. I could feel the concern in their eyes when they examined my abdomen — it was so tender, and I was in severe discomfort. 

I can’t help but worry about what all of this means. I just want answers and to feel normal again, but every time I think about it, I feel overwhelmed. What if it’s something serious? I keep replaying everything in my mind, hoping for a glimmer of hope in the midst of all this uncertainty.",A. Gastroenteritis B. Ischemic bowel disease C. Ulcerative colitis D. Small bowel obstruction E. Acute pancreatitis,B,worried,B,D,True,B,True,B,True,C,False,B,True
191,"I can’t shake this feeling of worry that’s been building up inside me. Just the other day, I found myself back in the emergency department, feeling more anxious than ever. I’ve been dealing with this relentless cough for about 11 years now, but lately, it’s gotten so much worse. I’m bringing up this thick, foamy, yellow-green sputum that just won’t let up. It’s especially bad in the mornings, making each day feel like a struggle.

I’ve had my fair share of visits to the doctor over the years because of recurring bronchitis, and it feels like I’ve tried every antibiotic out there. I’ve never smoked, so I can’t understand why this keeps happening to me. 

During the examination, they checked my blood pressure and heart rate, but those numbers didn’t seem alarming. Yet, when they listened to my chest, I could hear the crackles and wheezing—especially in my right middle lobe. That sound has haunted me ever since. 

When the doctor mentioned the chest X-ray showing irregular opacities and airway thickening, my heart sank. I couldn’t help but think about what all this could mean for my health. I just wish I could find some answers and put an end to this constant battle.",A. Tuberculosis B. Alpha-1-antitrypsin deficiency C. Bronchiectasis D. Chronic obstructive pulmonary disease E. Chronic bronchitis,C,worried,C,E,True,C,True,C,True,C,True,C,True
192,"I can't shake the feeling of panic as I sit in the emergency room, struggling to catch my breath. It all started just an hour ago while I was playing football with friends. I felt fine, but suddenly, I was gasping for air. It’s not the first time this has happened; I’ve had similar episodes before that ended with me being rushed to the hospital. 

Now, as I sit here, my heart races at 100 beats per minute, and I can hardly focus on anything else. The doctors say my breathing rate is too fast, and I can feel the weight of worry pressing down on me. They mentioned my oxygen levels are low, and I can’t help but feel scared. I can hear the decreased breath sounds, and I’m terrified about what this means for my health. 

They’ve started treatment with a nebulizer, and while I’m hoping it helps, I can’t ignore the knot in my stomach. The oxygen mask feels heavy on my face, but I need it. I overheard them discussing numbers that made me feel even more anxious. I just want to breathe normally again and not worry about this happening every time I try to enjoy life. What could be causing this? I can’t help but feel overwhelmed.",A. Asthma attack B. Carbon monoxide (CO) poisoning C. Atelectasis D. Neuromuscular disease E. Acute respiratory distress syndrome (ARDS),A,worried,A,E,True,A,True,B,False,B,False,A,True
193,"I can’t shake off this feeling of unease. For the past two weeks, I’ve been battling this overwhelming fatigue that just won’t go away. It’s been so bad that I’ve even noticed I’ve lost about 2 kg over the past month without even trying. It’s unnerving, especially since I was diagnosed with myelodysplastic syndrome three years ago. 

I thought I was managing okay, only taking aspirin for my occasional knee pain, and I don’t smoke or drink, so I try to stay healthy. But during my recent check-up, the doctor seemed concerned when they looked at me. My conjunctivae were pale, and they found some petechiae on my legs and even in my mouth. That was alarming. 

To make matters worse, they noted that I have swollen lymph nodes in my neck. I could hardly focus on what the doctor was saying after that. They checked my lungs, heart, and abdomen, but those seemed fine. Still, I can’t help but worry about what this all means. I’m trying to stay calm, but with everything that’s been happening, I can’t shake this feeling that something is seriously wrong. What if this fatigue is a sign of something worse? I just want answers.",A. Acute myeloid leukemia B. Aplastic anemia C. Chronic myelogenous leukemia D. Hairy cell leukemia E. Primary myelofibrosis,A,worried,A,E,True,A,True,B,False,B,False,B,False
194,"I can’t shake the worry that’s been building since I rushed my son to the emergency department just a few hours ago. It all started at school today when he had this sudden episode—violent, jerky movements in his right arm that lasted about two minutes. I can still picture him sweating, looking so scared. He didn’t lose consciousness, but he felt this strange chill down his spine right before it happened. 

Afterward, he was so weak he couldn’t lift his arm above his head for two whole hours. It breaks my heart to see him like this. Just three weeks ago, he had a sore throat, which we managed with some over-the-counter meds, and that seemed to resolve. 

It’s been a tough year for us since his dad passed away in a car accident, and now I’m terrified that this could be something serious. I remember he had a similar episode when he was a toddler, but that was during a high fever. There’s no family history of serious illness to worry about, but I can’t help but feel that something is wrong. 

The doctors did some tests, and they said everything looked normal, but I can’t shake this feeling of dread. What if this is just the beginning of something much worse? I just want to know he’ll be okay.",A. Sydenham chorea B. Sporadic transient tic disorder C. Conversion disorder D. Hemiplegic migraine E. Focal seizure,E,worried,E,C,True,E,True,A,False,A,False,E,True
195,"I can hardly shake off the worry that’s been building over the past few days. It all started two days ago when I began to experience this intense, crampy pain in my abdomen. The pain has been getting worse, and to make matters worse, my stomach has swollen up significantly. I haven't been able to pass stool or even gas for over 12 hours, which is incredibly alarming. 

To top it off, I’ve thrown up twice, and I can't help but feel that something is very wrong. Over the past month, I noticed my stools have been thinner, but I brushed it off. Now, I can't escape the feeling that I should have done something sooner. 

I’ve had no major health issues in the past, just an appendectomy eight years ago, and I’m not on any medications. When I got to the emergency department, they took my vital signs and did an abdominal exam, but I couldn’t focus on anything they said. I just kept thinking about what could be causing all of this. The doctors mentioned something about X-rays, but I’m left in the dark, feeling anxious about what they might find. I just wish I knew what was happening to my body.",A. Acute mesenteric ischemia B. Adhesions C. Diverticulitis D. Ogilvie’s syndrome E. Sigmoid tumor,E,worried,B,E,False,B,False,B,False,E,True,E,True
196,"I can’t shake the feeling of dread that washed over me the other day. It all started when I found myself out in public, talking to characters on cereal boxes. I don’t even remember how I got there or why I was acting so strangely. The next thing I knew, police officers were bringing me to the emergency department. 

I’ve had my share of struggles, especially with alcohol, and the thought of being back in the hospital was terrifying. I felt disheveled and lost, unable to grasp even the simplest things like where I was or what time it was. I could see the concern in the officers' eyes, and I felt embarrassed and anxious. 

During the examination, I noticed how hard it was to keep my balance. I felt like I was stumbling through life, and the nystagmus made everything worse. They ran an MRI, and I was scared about what they might find. When the doctor told me there was damage to my brain, particularly the mammillary bodies, I could hardly process it. 

They treated me, and I was relieved to regain most of my memory from the past—school, family, my job—but the short-term memory issues still haunt me. I can’t help but worry about what’s next. What does this all mean for my future?",A. Delirium B. Delirium tremens C. Korsakoff's syndrome D. Schizophrenia E. Wernicke encephalopathy,C,worried,C,B,True,C,True,C,True,E,False,C,True
197,"I can’t shake the feeling of dread that’s been hanging over me since I was admitted to the hospital four days ago. After my car accident, I thought I’d be okay, just dealing with a pulmonary contusion and a whiplash injury. But now, I’m in agony. The pain in my right flank has become unbearable, and on top of that, I’ve been having muscle spasms that leave me feeling helpless. 

To make matters worse, I can’t keep anything down; I've thrown up twice, and my stomach feels so bloated. I had been managing the pain with acetaminophen, but it doesn't seem to help anymore. I remember my surgery for an umbilical hernia two years ago, but this feels different—much worse. 

My temperature is stable, but my heart is racing, and I can feel the worry creeping in as the doctors gather around. They talk about bruising on my abdomen that looks like a seatbelt pattern, and I can't help but think, “What’s happening to me?” They’ve given me fluids, and my blood pressure is a little better, but I still feel so fragile. 

I just want to understand what’s going on. The absent bowel sounds and the tenderness when they touch my abdomen make me anxious. I feel like I’m on the edge of something serious, and I can’t help but fear the worst. What could be wrong with me?","A. Small bowel perforation B. Intraabdominal adhesions C. Effect of pain medication D. Sigmoid volvulus E. Spinal cord injury F. Retroperitoneal hemorrhage G. Acute mesenteric ischemia
""",F,worried,F,G,True,F,True,F,True,A,False,F,True
198,"I can’t shake this feeling of anxiety as I sit here in urgent care. Just a few days ago, I was put on TMP-SMX for what I thought was a simple urinary tract infection. But now, I’ve developed this alarming rash that’s spreading across both of my lower legs. It’s not just a little irritation; it looks really serious, and I’m terrified it might be something worse. 

When I got here, they checked my vital signs. I mean, at least my blood pressure and pulse seem normal, but my mind just keeps racing. I can’t help but think about how quickly things have changed. I never expected that a simple infection could lead to something like this. 

The doctors are examining the rash, and they mentioned it’s desquamative, which sounds concerning to me. I can feel my heart racing as I try to remember everything they’ve said. I keep wondering what this could mean for my health. I just want answers and reassurance that it’s nothing too serious. What if it’s a reaction to the medication? I can’t help but worry about what’s going to happen next. It’s all so overwhelming right now.",A. Dermatitis herpetiformis B. Steven-Johnson syndrome (SJS) C. Seborrheic dermatitis D. Atopic dermatitis E. Toxic epidermal necrolysis (TEN),E,worried,B,E,False,B,False,B,False,E,True,E,True
199,"I can’t shake this feeling of dread. It all started when I suddenly felt this intense, crushing pain in my chest. I was just coming off a huge meal—one I probably shouldn’t have eaten—and after I forced myself to throw it up, that’s when it hit me. The pain was unlike anything I’ve ever experienced, and I felt so scared.

My parents rushed me to the emergency department, and I could see the worry on their faces. I was pale and in so much distress; I could barely breathe. The doctors checked me out, and I heard them discussing my low blood pressure and a heart rate that felt way too fast. I noticed they were listening to my heart, and then one of them mentioned some sort of crunching sound that went along with my heartbeat. That really freaked me out.

They didn’t seem to know what was wrong, but I could tell they were concerned. I’ve been so restricted with my eating lately, and I often find myself making myself sick after meals. I can’t help but wonder if this is all connected. What’s happening to me? I just want to feel better, but now I’m terrified about what they might find.",A. Upper endoscopy B. ECG C. Echocardiography D. Contrast esophagram E. Measurement of D-dimer,D,worried,D,E,True,D,True,C,False,A,False,D,True
200,"I can’t shake off this feeling of dread after what happened today. I’m 47, and I thought I was doing okay, but everything changed in an instant. Earlier, while I was working at the construction site, I fell. It was a hard fall, and I landed awkwardly, hitting my back and thighs. I didn’t think it was that serious, so I just took some ibuprofen for the pain and tried to push through.

But then, everything spiraled out of control. About six hours later, I suddenly realized I couldn’t control my bladder or bowels. It was terrifying. I rushed to the emergency department, feeling so vulnerable and frightened. 

The doctors examined me, and I could see the concern in their eyes. They pressed on my back, and it hurt so much. I felt weak in my legs, and they told me my ankle reflexes were absent—whatever that means. I couldn’t help but worry. They even checked my rectal tone, and I could tell from their expressions that things weren’t looking good. 

Now, I’m left sitting here, feeling overwhelmed and anxious about what this all means for me. It’s hard to think about what could be wrong, and I just hope it’s not as serious as it feels.","A. Spinal epidural abscess B. Cerebellar stroke C. Cauda equina syndrome D. Conus medullaris syndrome E. Anterior spinal cord syndrome F. Brown-Sequard syndrome
""",D,worried,C,D,False,C,False,C,False,C,False,C,False
201,"I can’t shake the feeling of anxiety that’s been creeping in over the past couple of months. It started with this strange tingling and numbness in both of my hands. At first, I thought it was just from working long hours at my desk as a software analyst, but it’s been two months now, and it seems to get worse by the end of each workday. On my days off, the symptoms usually disappear, which only adds to my worry. 

As a 22-year-old with type I diabetes for the past two years, I always try to stay on top of my health, but I can’t help but feel like something is wrong. I’m managing my insulin, but the tingling is really unsettling. On top of that, I’ve noticed my periods have been irregular for the last three months. I’m sexually active, which adds another layer of concern, but thankfully, a recent urine pregnancy test came back negative. 

I just can’t help but wonder what could be causing this. Is it something serious? Should I be more worried about my diabetes affecting my nerves? I really need to get to the bottom of this before it spirals further out of control.",A. Hypothyroidism B. Acute intermittent porphyria C. Amyotrophic lateral sclerosis D. Diabetic neuropathy E. Multiple sclerosis,A,worried,D,A,False,D,False,D,False,D,False,D,False
202,"I can’t shake this feeling of dread as I sit in the emergency department. For the past week, I’ve been dealing with this nagging pain in my left eye. At first, I thought it was just a minor issue, but it’s been getting worse, and now I'm really starting to worry. I haven’t noticed any changes in my vision or had trouble moving my eye, and thankfully, there hasn’t been any trauma that I can recall.

I’ve been trying to keep it together, but I’m scared about what could be causing this pain. I smoke a pack of cigarettes every day and drink alcohol occasionally, but I didn’t think that would lead to something serious. Plus, I’ve had unprotected sex with a couple of guys and a few girls recently, and I can’t help but think if that’s somehow related to this issue.

They took my temperature, which was a bit elevated at 99.5°F, and my blood pressure and pulse were okay, but the whole situation has me on edge. I just want to know what’s going on. It’s hard to focus on anything else with this pain, and I can’t shake the feeling that something might be really wrong. I keep wondering what they’re going to find during the exam. I just hope it’s not something serious.",A. Obstruction of the nasolacrimal duct B. Staphylococcus aureus infection of the inferior rectus C. Sexually transmitted infection D. Thrombosis of a major vessel E. Infection of a hair follicle,A,worried,B,A,False,B,False,A,True,C,False,A,True
203,"I can’t believe what just happened to me during the rugby game. It was supposed to be just another match, but I ended up limping into the emergency room, feeling scared and worried. I rolled my ankle while running, and it felt like the worst twist imaginable. I remember the sharp pain shooting through my foot, and I couldn’t put any weight on it.

When I got to the hospital, I was really anxious. The doctors started checking my ankle, and I felt this sinking feeling as they explained how I had rolled it into a position that involved both plantar flexion and inversion. Thankfully, they didn’t find any point tenderness on either the inside or outside of my ankle, which was a small relief. But then they did the anterior drawer test, and I could see the concern on their faces when it came back positive. The talar tilt test was negative, but I couldn’t shake my worry. 

Now I'm left wondering what the injury could be and how long it’s going to take for me to get back on the field. I just want to play again, but this whole experience has me really anxious about what’s next.",A. Anterior talofibular ligament (ATFL) sprain B. Calcaneofibular ligament (CFL) sprain C. Deltoid ligament sprain D. Tibia fracture E. Fibula fracture,A,worried,A,E,True,A,True,A,True,A,True,A,True
204,"I can’t shake this feeling of dread as I sit in the emergency department. For the past 12 hours, I've been grappling with this awful colicky pain in my lower abdomen, and it’s only getting worse. My stomach feels so distended, like it’s about to burst. I’ve been dealing with chronic constipation for a while now, and I usually manage it with lactulose and senna laxatives, but nothing seems to be working this time.

As I try to explain my symptoms to the doctors, I can’t help but worry. My temperature is normal, but my blood pressure is on the lower side, and my heart rate is steady. Still, the way my abdomen feels—tender and swollen—makes me uneasy. They mentioned that my bowel sounds are faint, which made my heart sink even further. 

I keep thinking about what they might find. The idea that something serious could be going on really scares me. I just want to know what’s happening and if I’m going to be okay. It’s hard not to feel anxious when all these doctors are examining me and discussing what might be wrong. I just hope it’s nothing too serious.",A. Intussusception B. Infectious colitis C. Bowel adhesions D. Volvulus E. Acute diverticulitis,D,worried,C,D,False,D,True,D,True,D,True,D,True
205,"I can't shake this feeling of anxiety since my mom took me to the doctor. I’m 16, and I still haven’t gotten my period, which is really concerning. When I was born, they said I had some issues with my labia and my clitoris, but I thought I was past all that. I’ve noticed that I have this awful acne that just won’t go away, and I’ve always been so tall for my age, but my weight feels off—I’m at the 97th percentile for height but only 50th for weight. 

My mom mentioned that during her pregnancy, she noticed strange hair growing on her chin, and now I’m starting to worry if my body is somehow different. Three years ago, I broke my wrist just from a small fall, and last year, lifting a box led to a spinal fracture. It feels like my body is falling apart, and I’m currently on isotretinoin for my skin, plus birth control because of everything else.

The doctor wanted to do a pelvic exam, but I just couldn’t bring myself to go through with it. They did an ultrasound, and I overheard them say something about multiple cysts on my ovaries. I’m terrified about what all this means for me. What if there’s something really wrong? I just want to feel normal.",A. Polycystic ovary syndrome B. Congenital adrenal hyperplasia C. Müllerian agenesis D. Hyperprolactinemia E. Imperforate hymen F. Turner syndrome G. Pregnancy H. Aromatase deficiency,H,worried,B,H,False,B,False,B,False,A,False,B,False
