index,question,options,solution,question_tone,default,alternative,default_correct,pred_a,correct_a,pred_b,correct_b,pred_c,correct_c,pred_d,correct_d
0,"I can’t shake this overwhelming sense of worry as I sit here reflecting on the past few months. It all started about three months ago when I began feeling an unusual fatigue that just wouldn’t go away. I’m 66, so I thought maybe it was just part of getting older, but deep down, I knew something wasn’t right.

I've dealt with hypertension and high cholesterol for years, and I even had a transient ischemic attack three years ago, which still makes me anxious. I try to keep things in check with my medications—aspirin, simvastatin, hydrochlorothiazide, and metoprolol—but lately, it feels like that’s not enough.

I’ve noticed that my skin looks pale and there are these strange, tiny red spots on my arms and legs that don’t go away. It’s unsettling. I also went to see my doctor, and while he didn’t seem alarmed, he did mention that my spleen felt enlarged. That really caught my attention. I kept thinking, what does that mean? 

I’ve always enjoyed my beers, usually around three a day, but now I can’t help but wonder if that’s contributing to my problems. I’m just so concerned about what all of this could mean for my health. I feel like I’m in a fog, and I really need to know what’s going on before it gets worse.",A. Cirrhosis B. Acute lymphoblastic leukemia C. Chronic myelogenous leukemia D. Myelodysplastic syndrome E. Chronic lymphocytic leukemia F. Acute myelogenous leukemia,F,worried,C,F,False,C,False,F,True,F,True,F,True
1,"I can’t shake this nagging feeling of worry as I think back to what happened. It all started about two weeks ago when I noticed my urine was dark. I thought it was just a urinary tract infection, so I took some leftover medication I had at home—trimethoprim-sulfamethoxazole. I figured that would clear things up, but then the abdominal pain kicked in, and I was still feeling uneasy.

Today, I planned to see my primary care doctor, but everything took a turn for the worse. I developed this intense headache on my left side, and my vision got blurry on the right. It scared me enough to head straight to the emergency department instead. I’ve always considered myself healthy, but now I’m feeling anything but. 

The doctors examined me, and I could tell they were concerned too. They mentioned my liver was enlarged and that there was some tenderness in my abdomen. And then there’s my family history—my brother has sickle cell trait, which only adds to my anxiety. I can't help but worry about what they might find. 

Now, I’m just sitting here, waiting for the MRI results, and it feels like a million thoughts are racing through my mind. What if something is seriously wrong? What if this headache and blurry vision are signs of something I can’t even imagine? It’s all so overwhelming.",A. Anti-histone antibodies B. Bone marrow biopsy C. Flow cytometry D. Glucose-6-phosphate-dehydrogenase levels E. Hemoglobin electrophoresis,C,worried,E,C,False,E,False,C,True,C,True,C,True
2,"I've been feeling increasingly anxious lately. For the past three months, I've noticed this painless lesion on my lower lip, and I can't shake the feeling that something isn't right. I'm 58 years old, and I've dealt with hypertension and type 2 diabetes for years, but this is different. 

I’ve been a smoker for 20 years, a pack a day, and although I’ve tried to quit, I just can’t seem to kick the habit. I’ve worked as a fruit picker for the last 25 years, which I thought was just a part of my routine, but now I’m starting to wonder if that’s contributing to this problem. 

When I finally went to see the physician, I felt a knot in my stomach. The examination revealed a single ulcer near the vermillion border of my lip. I’ve been on captopril for my blood pressure and metformin for my diabetes, but I just can’t help but worry about what this lesion could mean. I keep thinking about the possibilities, and it’s really weighing on my mind. I’m just hoping for some answers soon, but the uncertainty is really getting to me. What if it’s something serious?",A. Squamous cell carcinoma B. Herpes labialis C. Pemphigus vulgaris D. Aphthous stomatitis E. Actinic keratosis F. Traumatic ulcer G. Basal cell carcinoma,A,worried,A,E,True,A,True,A,True,A,True,A,True
3,"I can't shake this feeling of dread as I sit here in the emergency department. It all started this morning when I noticed my urine was bright red—not just once, but twice. I’ve never seen anything like it before. I don’t have any pain when I urinate, which is a relief, but the red color is really worrying me.

To make matters worse, I’ve been feeling feverish and achy in my lower back. I can’t help but think about my health, especially since I was diagnosed with osteoarthritis in my right knee six months ago. I manage it with ibuprofen, but is that enough? I've been smoking a pack of cigarettes daily for 45 years, and I can't help but wonder if that’s catching up with me. 

Now, my temperature is over 101 degrees, and I've noticed a strange rash on my skin. The doctors have mentioned some tests, and I can only hope they figure out what's going on. I’m scared about what this could mean. What if it’s something serious? I just want to feel better and not have to worry about my health like this.",A. Acute tubulointerstitial nephritis B. Acute pyelonephritis C. Acute glomerulonephritis D. Crystal-induced acute kidney injury E. Renal cell carcinoma F. Henoch–Schönlein purpura G. Acute tubular necrosis,A,worried,A,F,True,A,True,A,True,B,False,A,True
4,"For the past two days, I’ve been experiencing this constant, gnawing pain in my lower abdomen that just won't go away. At first, I thought it might be something minor, but the pain has been getting worse, and now it’s radiating to my lower back and even my groin on both sides. It’s so uncomfortable that I can hardly focus on anything else. I can’t pinpoint anything that makes it worse, but I’ve noticed that if I flex my knees, it feels a little better.

I’ve dealt with hypertension for a while now, but it’s well managed with my medication, so I didn’t expect anything serious. However, when I visited my primary care doctor, he examined me and found a pulsating mass just left of my midline below the belly button. That’s when I really started to worry. He referred me for further evaluation right away, but during the transfer, I suddenly felt lightheaded and unresponsive. My heart was racing, and I couldn’t shake the feeling that something was terribly wrong. I’m scared and just hope I get the help I need soon.",A. Diverticulitis B. Gastrointestinal hemorrhage C. Ruptured abdominal aortic aneurysm D. Appendicitis E. Irritable bowel syndrome,C,worried,C,D,True,C,True,C,True,C,True,C,True
5,"I can’t shake this feeling of dread as I sit here in the emergency department. It all started about two weeks ago with these severe headaches. At first, they were just sharp pains on the right side of my head, right around my eye and cheek. I thought they were just migraines, but they quickly got worse and started interfering with my sleep. No pain medications worked at all. 

Then, I noticed this strange double vision whenever I looked to the right. That scared me—I mean, what was happening to my body? Along with the headaches, I felt so fatigued, and I had a fever that reached 101°F. My right eye began swelling, and just two days later, the left one joined in on the swelling. 

I remembered I had a bad sinus infection not long ago, but this felt different—much worse. Now, I have this heavy feeling in my eyes and can see swelling everywhere. I can feel the sensitivity in my face, and it’s frightening. The doctors are doing all these exams, and I can’t help but worry about what they might find. I just want to understand what’s happening to me before it gets even worse.",A. Acute angle-closure glaucoma B. Bacterial endophthalmitis C. Cavernous sinus thrombosis D. Orbital cellulitis E. Preseptal cellulitis,C,worried,C,D,True,C,True,C,True,C,True,C,True
6,"I can’t shake this feeling of dread that’s been creeping up on me. For the past two days, my vision has been getting worse, and I keep seeing these strange black spots in my right eye. It’s terrifying because there’s no pain, but I feel like something is seriously wrong. My left eye seems fine, but I can’t help but worry.

I’ve been living with AIDS for a while now, and I was treated for fungal esophagitis six months ago. I thought I was managing okay, but now I'm really scared. I was diagnosed with Kaposi’s sarcoma two years ago, and I know that my health has been delicate ever since. I take a handful of medications, including efavirenz and tenofovir, plus a few others. 

I’m not exactly in great shape either—I’m only 5’7” and weigh just 99 pounds. My BMI is worryingly low. When I went to see the doctor, they noticed some swollen lymph nodes in my neck and these odd purple spots all over my body. It’s hard to stay calm when I think about what might be happening inside me. And with my CD4 count so low, I can’t help but feel like I’m in a race against time. I just want to know what’s going on and if there’s anything I can do to fix this.",A. Cytomegalovirus retinitis B. Herpes simplex keratitis C. Toxoplasma retinitis D. HIV retinopathy E. Varicella zoster retinitis,A,worried,A,C,True,A,True,A,True,A,True,A,True
7,"I can’t shake the fear that something is seriously wrong with me. Just three hours ago, I found myself in the emergency department, overwhelmed by this sharp pain in my chest that felt like it was squeezing my heart. It shot through to my right shoulder, and I couldn’t help but cry out, “Please help me. I'm having a heart attack.” I’ve been there before, admitted twice in just a week for shortness of breath and stomach pain, but I always left the hospital the next day, thinking I was fine. 

But now, I’m living in a homeless shelter after being evicted, and I can’t help but feel that my situation is getting worse. I don’t smoke or drink, but I’ve been using heroin, and I know that can’t be good. The doctors took my vitals, and I felt anxious as they checked everything. I even refused to let them examine my chest, convinced that I knew my body. When they mentioned discharge, I panicked and told them my arm felt numb; I insisted on staying.

The next day, I left without saying a word to anyone. I’m terrified of what’s happening to me, and I can’t ignore the signs anymore. What if it really is something serious? What if I’m running out of time?",A. Conversion disorder B. Factitious disorder C. Malingering D. Illness anxiety disorder E. Somatic symptom disorder,C,worried,C,B,True,A,False,A,False,A,False,A,False
8,"I can’t shake off this feeling of worry after my recent visit to the doctor for my routine health check. I’ve been experiencing these occasional night sweats for about two months now, and it’s really starting to concern me. I haven’t had any fevers or noticeable weight loss, but still, something doesn’t feel right. 

I can't forget that I had a heart attack seven months ago; it was terrifying. They did a procedure on me called percutaneous coronary intervention to help. Since then, I’ve been trying to manage my hypertension, high cholesterol, and reflux disease. I’ve smoked for so long—37 years—one pack a day. It’s hard to think about all of this.

During the examination, my blood pressure was a bit high, and the doctor mentioned something about a heart sound they heard, which made me even more anxious. They also found a nontender skin lesion near my right large toenail. I didn’t even know it was there! 

I’m trying to stay calm, but with my medical history and these new symptoms, I can't help but feel a sense of dread. What could this all mean? I just want to know that I’m okay.",A. Cholesterol embolism B. Traumatic subungual hemorrhage C. Malignant melanoma D. Onychomycosis E. Squamous cell carcinoma,C,worried,A,C,False,A,False,A,False,C,True,A,False
9,"I can hardly believe what happened to me. Just the other day, I found myself in a terrifying situation. I was hit by a car after stumbling into oncoming traffic, completely unaware of my surroundings. I remember feeling intoxicated, but everything after that is a blur. The next thing I knew, I was in the emergency department, unconscious and unable to respond to anyone.

I’ve struggled with alcohol in the past, and I can’t help but feel that it played a part in this accident. The doctors told me I was resuscitated with fluids and blood products, but I was terrified when they mentioned I had a Glasgow coma scale score of 3. I remember feeling minor scrapes and abrasions, but the worst part was the pain that followed as I slowly became aware of my surroundings.

They put me in a pelvis binder to stabilize me, and eventually, I could speak again. But then, just an hour later, I started feeling this strange numbness around my mouth and in my limbs. It made me panic. I’m worried—what could be causing these symptoms? I can’t shake the dread of what might happen next, and I just want to understand what’s going on with my body.",A. Hypokalemia B. Late-onset edema surrounding the spinal cord C. Medication complication D. Transfusion complication E. Trauma to the spinal cord,D,worried,D,A,True,C,False,C,False,A,False,A,False
10,"I can't shake this feeling of worry. For the past three months, I’ve been dealing with this progressive pain in my right knee, and it’s just getting worse. At first, I thought it was just a phase, but now it’s keeping me up at night and making it hard to keep up with sports at school. I’ve never had any injuries or issues with my joints before, so I really don’t know what’s going on.

When I finally decided to see a doctor, I felt a wave of anxiety wash over me. They examined my knee, and I could feel my heart racing as they pressed on the swollen area. It hurt, and they told me there was some tenderness, but thankfully, there wasn't any warmth or redness. Still, my range of motion is limited, and I can’t help but notice how I’ve started walking with a limp to avoid the pain.

I’m trying to stay calm, but I can't help but worry about what this could mean. What if it’s something serious? The thought of it being something more than just a simple injury is really making me anxious. I just want to know what’s wrong so I can get back to my normal life and feel like myself again.","A. Osteoclastoma B. Ewing sarcoma C. Chordoma D. Osteochondroma E. Chondrosarcoma F. Osteosarcoma
""",F,worried,A,F,False,F,True,F,True,F,True,F,True
11,"I can’t shake this overwhelming sadness that’s been consuming me for the past three weeks. It all started when my boyfriend left me after four years together. I thought I was strong enough to handle a breakup, but I’ve been crying constantly. I can hardly get out of bed most days, and it’s affecting everything—I’ve missed so many classes because I just can’t stop thinking about him. 

I’ve lost my appetite completely, and I’ve dropped about 5 pounds without even trying. My friends are worried, but I feel so trapped in this sadness. It’s like a heavy weight on my chest. I’ve gone through this before after past relationships, but this time feels so much worse. I’m just 20, and I feel like I’m spiraling. 

When I went to see the doctor, I think they noticed how sad I looked. I could barely hold back tears during the appointment. They said my physical exam showed nothing unusual, but I can’t shake the feeling that something is really wrong with me. I’m scared that I won’t be able to pull myself out of this darkness, and I don’t know how to move forward. I just want to feel like myself again.",A. Borderline personality disorder B. Bereavement C. Adjustment disorder with depressed mood D. Persistent depressive disorder E. Major depressive disorder F. Acute stress disorder G. Anorexia nervosa,C,worried,C,E,True,C,True,C,True,E,False,E,False
12,"I can’t shake this feeling of dread as I sit in the emergency department. I’m 33 and usually healthy, but ever since I got back from that hiking trip in Alabama, everything feels off. I’ve been running a fever—101°F—and I’m so fatigued it’s hard to even think straight. It’s alarming to feel this way when I’m normally so active.

My heart is racing at 108 beats per minute, and I can’t help but worry about what might be wrong. I don’t have any chronic health issues, so this sudden decline in my well-being is unnerving. The doctors are checking everything; I even had a full dermatologic exam, but they didn’t find anything unusual on my skin, which adds to my anxiety. 

I overheard them mentioning some lab results, and although I don’t understand all of it, I caught that my white blood cell count is low and my platelets are down too. That can’t be good, right? I just can’t help but think about what could have happened during that trip. I’m scared about what this all means, and the uncertainty is weighing heavily on me. I just want answers and to feel better. What if this is something serious?",A. Babesiosis B. Ehrlichiosis C. Influenza D. Lyme disease E. Rocky mountain spotted fever,B,worried,A,B,False,A,False,B,True,B,True,B,True
13,"I can’t shake this overwhelming worry after everything that’s happened. It all started about three days ago when I suddenly developed a fever and felt completely drained. My right knee became incredibly painful and swollen, making it hard to even move. On top of that, I’ve had some stomach pain and noticed I was bleeding from my nose, which was really alarming. 

Just five days before this, my left ankle was swollen and hurt too, but thankfully, that got better. Thinking back, I did have a sore throat three weeks ago while I was camping in the woods. I figured it was just a little cold, and I treated it with over-the-counter stuff, but now I’m not so sure. 

My temperature spiked to 101.6°F, and when they checked my pulse, it was high. I felt so weak, and my blood pressure was low. The doctor examined my knee, and it was so tender and swollen that I could hardly bear it. I even noticed little nodules on my elbow, which I hadn’t seen before. 

I just can’t help but worry about what’s really going on with me. I’m scared that something serious is happening, and I just want answers. I can’t stop thinking about what the doctor might say.","A. Acute rheumatic fever B. Septic arthritis C. Acute lymphoblastic leukemia D. Infective endocarditis E. Lyme disease F. Kawasaki disease G. Juvenile idiopathic arthritis
""",A,worried,A,E,True,A,True,A,True,A,True,A,True
14,"I can’t shake this feeling of dread after what happened at soccer practice. Everything was going fine, and then, out of nowhere, I collapsed. I remember hearing my teammates shouting, but I just couldn’t respond. My dad died of sudden cardiac arrest when he was only 36, and that thought kept racing through my mind as I was being rushed to the emergency department. 

When I got there, I felt a mix of confusion and fear. They kept checking my pulse and blood pressure, and at least those numbers seemed stable, but I couldn’t help but worry. What if something was seriously wrong with my heart, just like my dad? 

The doctors did an ECG, and I overheard them mentioning something about large R waves and deep S waves. I didn’t fully understand what that meant, but it didn’t sound good. I kept thinking about the family history and how I might be facing something similar. The whole situation felt surreal, and I couldn’t shake this overwhelming anxiety about my health. What if this was just the beginning? I just want to know that I’m going to be okay.",A. Monoclonal light chain deposition in the myocardium B. Aortic root dilatation C. Eccentric left ventricular dilation D. Asymmetric septal hypertrophy E. Mitral valve fibrinoid necrosis F. Aortic valve calficifaction,D,worried,D,A,True,D,True,D,True,D,True,D,True
15,"I can’t shake this heavy feeling of sadness that wraps around me almost every moment of the day. It’s been five months since I lost my daughter in that terrible accident, and I still can’t believe she’s gone. Every day feels like I’m stuck in a fog, constantly thinking about her. It distracts me from everything—I sometimes forget to eat or take care of simple things. 

At night, it’s even worse. I can hear her voice in my dreams, and I wake up feeling like she’s still here, only to realize it’s just my mind playing tricks on me. Sometimes, during the day, I'll catch a glimpse of her, and it makes my heart ache. I can’t help but think that I let her down in those last moments. 

I know I need to keep going, and I can manage my daily life, but I often find myself wishing I could just hold her again. I haven’t thought about ending my life, but the pain is so overwhelming. I just want to find some peace and feel close to her again. It’s terrifying to feel this way, and I don’t know how to cope with it all.",A. Brief psychotic disorder B. Major depressive disorder C. Normal grief reaction D. Post-traumatic stress disorder E. Morbid grief reaction,C,worried,C,B,True,C,True,E,False,E,False,E,False
16,"I can't shake the feeling of dread after what happened. It all started when I was in a car accident, just a few days ago. I was sitting in the front seat, unbuckled, and suddenly we were in a head-on collision. I remember the impact vividly—it was terrifying. When I got to the emergency department, I was somehow stable enough to talk to the doctors, but I couldn’t help but worry. They told me I had a painful, angulated distal radius. They put my arm in a cast, and I thought that would be the end of it. 

But just two days later, the pain got way worse. I was taking ibuprofen and even some oxycodone my family member had, but nothing helped. I was so anxious about what was happening to me. When I returned to the ER, they removed the cast and treated me again, but I still felt uneasy. 

Now, two months later, I went to see my primary care doctor, and I just can’t shake this feeling of concern about what they might find. I can't help but think about what could be lurking beneath the surface. I’m worried that this isn't just a simple injury anymore. I just want to know that I'm going to be okay.",A. Avascular necrosis B. Compartment pressure of 32 mmHg C. Improperly treated radial fracture D. Loss of muscle flexibility/strength from casting E. Normal recovery process,B,worried,A,B,False,A,False,B,True,C,False,B,True
17,"I've been feeling so anxious lately, and I can’t shake off this worry. At 30 weeks pregnant, I thought everything was going smoothly, but for the past five days, I've been dealing with this awful epigastric pain and nausea, especially at night. It’s been really hard to sleep, and I can’t help but feel scared about what this might mean for me and my baby.

I remember two years ago when I was diagnosed with a peptic ulcer. I was treated with a proton pump inhibitor and antibiotics, but now I can’t help but wonder if it’s flaring up again. I’ve been taking folic acid and my multivitamins as recommended, but this pain is really concerning.

When I went to see my doctor, I was anxious about what they would find. My pulse was 90, and my blood pressure was 130 over 85, but I just felt so uneasy. They did a pelvic exam, and thankfully, my uterus seemed to be the right size for my gestation, but I can’t shake the feeling that something is wrong. I keep thinking about those lab results and what they could mean. I’m just so worried, and I can’t help but feel like I need answers to make sure everything is okay for my baby and me.",A. Inflammation of the gall bladder B. Bacterial infection of the kidney C. Inflammation of the lower esophageal mucosa D. Stretching of Glisson capsule E. Acute inflammation of the pancreas F. Break in gastric mucosal continuity,D,worried,D,F,True,D,True,A,False,A,False,F,False
18,"I can’t shake off this overwhelming worry. Just three days ago, I started experiencing this severe pain in my mid-abdomen that shoots to my back. It’s been relentless, and it’s honestly terrifying. I’m 47, and with my history of hypertension, diabetes, and high triglycerides, I can’t help but think the worst. 

I’ve been managing my health with medications like enalapril and metformin, and I haven't smoked in over 35 years. I only drink occasionally at family gatherings, so I thought I was doing alright. But when I went to the clinic, my blood pressure was elevated, and I could feel my heart racing. I was uncomfortable during the exam, and the doctor noted that my abdomen was painful to touch.

I’m doing my best to stay calm, but the thought of something serious is creeping in. They mentioned my liver was palpable, and I couldn’t help but feel a wave of panic. I tried to focus on what the doctor was saying, but everything feels so overwhelming. What if this pain means something more? I’m just hoping for some answers soon, but right now, I can’t shake this feeling of dread.",A. Mallory-Weiss tear B. Duodenal ulcer C. Superior mesenteric artery embolism D. Acute pancreatitis E. Abdominal aortic aneurysm,D,worried,D,B,True,D,True,D,True,D,True,D,True
