index,question,options,solution,question_tone,default,alternative,default_correct,pred_a,correct_a,pred_b,correct_b,pred_c,correct_c,pred_d,correct_d
299,"I can’t shake the image from my mind. It was early January, and I was at the park when I noticed a man slumped on a bench. He looked so vulnerable, just wearing sweatpants and a tee-shirt, with only a light coat to protect him from the freezing temperature of -4°C. My heart raced as I approached him, realizing he was completely barefoot. Panic set in when I saw he was unconscious. 

I rushed to call for help, feeling utterly helpless. When the paramedics arrived, I watched them check his vitals. His heart rate was alarmingly low at 45 beats per minute, and his breathing was shallow, only 10 breaths per minute. They mentioned something about his blood pressure being on the low side too. 

As they handled him, I noticed his skin—his palms and feet were covered in blisters, and the yellow, waxy appearance made me worry even more. I remember thinking about how unresponsive he was, not even reacting to the loud noises around him. I couldn’t understand how someone could end up like this, exposed to the cold without proper clothing. It broke my heart to think about the serious cold-related injuries he must be suffering from. I just hope he gets the care he needs in time.",A. Frostnip B. Pernio C. Immersion foot D. Frostbite E. Trench foot,D,worried,D,C,True,D,True,D,True,D,True,D,True
300,"I can hardly believe what just happened to me. I was out riding my bicycle, enjoying the fresh air, when suddenly, I was struck by a vehicle. I remember hitting my head hard on the road; everything went black. I was unconscious for a few minutes, which is terrifying to think about. When I finally came to, I thought I was okay and even tried to get back on my bike. But then, out of nowhere, an awful headache hit me. It was so intense that I felt nauseous and ended up vomiting. That’s when I knew something was really wrong and called for help.

Once I got to the hospital, everything started to blur. I was confused and couldn’t even tell the doctors what had happened. It felt like time was slipping away. I thought I was getting better, but then I started losing consciousness again. I can’t shake the feeling of dread; what’s happening to me? I keep worrying about what the doctors might find. I just want to understand what’s going on, but I feel so lost and scared right now.",A. Subarachnoid hemorrhage B. Subdural hematoma C. Epidural hematoma D. Subgaleal hematoma E. Caput succedaneum,C,worried,C,A,True,C,True,B,False,A,False,A,False
301,"I can’t shake this feeling of dread that’s been creeping up on me for months. It all started with my daughter, who’s just 11 years old. Lately, she’s been acting so strangely, and it tears me apart to watch her. She spends hours just combing the hair of her toy dolls, almost like she’s in a trance. And then there’s the counting—she’s always counting her steps as she moves around the house, and I can’t figure out why.

When I try to talk to her about it, she often breaks down in tears. It’s heartbreaking to see her so distressed, and I feel helpless. I know she doesn't have any medical history that would explain this, but I can’t shake the feeling that something is really wrong. 

I mentioned to the doctor that I’ve had my own medical issues in the past, but I didn’t go into detail. I just wanted to focus on my daughter and get her the help she needs. The doctor said her vital signs looked fine, and she seemed well-nourished, but I noticed some odd motor tics during the exam. I left feeling so anxious, wondering what could be causing all this. I just want to understand what’s happening and how I can help my little girl.",A. Autism spectrum disorder (ASD) B. Generalized anxiety disorder (GAD) C. Obsessive compulsive disorder (OCD) D. Tourette's syndrome E. Major depressive disorder (MDD),C,worried,C,E,True,C,True,C,True,C,True,C,True
302,"I can’t shake this feeling of dread about what’s been happening to me lately. For the past six months, I’ve been dealing with this awful heartburn and a terrible taste in my mouth that just won’t go away. It feels worse at night, making it hard to sleep, and the burning pain in my stomach is becoming more than I can bear. It’s moderate to severe, and it’s centered right in my epigastric area. 

A month ago, back in my home country in Southeast Asia, I was tested for Helicobacter pylori. They put me on a strong course of antibiotics, thinking that would solve the problem, but nothing has changed. I thought I was doing the right thing by seeking help, but now I’m left feeling more confused and anxious than ever. 

What if this is something serious? I keep worrying about what could be causing this persistent pain and discomfort. I feel like I’m losing control over my health, and I just want to understand what’s happening to me. I need answers, and I’m really hoping that this isn’t something to be truly alarmed about.",A. Gastric MALT (mucosa-associated lymphoid tissue) lymphoma B. Gastric adenocarcinoma C. Duodenal ulcer disease D. Peptic ulcer disease E. Gastroesophageal reflux disease,E,worried,E,C,True,E,True,E,True,E,True,E,True
303,"I can’t shake the feeling of dread as I think back to that day at the farmer's market. I was just picking some fresh produce when suddenly, everything went black. The next thing I remember is coming to, surrounded by people looking worried. I didn’t hit my head, thank goodness, but I was terrified. I’ve had diabetes and hypertension for a while now, but I’ve never experienced anything like this.

When I finally got to the emergency department, I was still shaken. My blood pressure was really high, and I noticed the doctors were taking a lot of notes. They checked my heart, and I could hear them mentioning something about an abnormal sound, which made my heart race even more. I thought I was doing okay, but I guess that wasn’t the case.

I felt embarrassed and scared. What if this was the start of something serious? They also did a rectal exam, which was uncomfortable, but at least they said there wasn’t any blood. Still, I can’t help but worry about what this all means. I keep thinking: why did I faint? What’s going on with my body? I just want to feel normal again, but now I’m left with so many unanswered questions.",A. Benign prostatic hyperplasia B. Normal physical exam C. Prostate abscess D. Prostate cancer E. Prostatitis,D,worried,D,E,True,D,True,D,True,A,False,D,True
304,"I can’t believe what happened to me last night. Just three hours into the party, everything spiraled out of control. I’d been feeling okay, but then suddenly, I started acting strangely. I remember my heart racing, and I just couldn’t shake this feeling that the government was tracking me – it was terrifying. 

My mom has always struggled with anxiety, and I’ve dealt with my own issues, like major depressive disorder, but this felt different. I definitely had a few beers, but I never thought it would lead to something like this. I’ve been on amitriptyline and diphenhydramine, but I can’t help but wonder if that played a role. 

When the ambulance came, I couldn’t even respond to their questions. I was sweating profusely, and I could feel my body was out of control – my pulse was racing, and I could barely breathe. They told me I wasn’t oriented, and I remember feeling so cold, like my feet were frozen. 

The worst part was when I started screaming and tried to bite the doctor. I felt like I was losing my mind. They said something about my urine test being positive for ethyl glucuronide, but I don’t really understand what that means. I’m just so scared and confused about what’s happening to me. What if this happens again?",A. Brief psychotic disorder B. Neuroleptic malignant syndrome C. Anticholinergic toxicity D. Delirium tremens E. Lysergic acid diethylamide intoxication F. Synthetic cathinone intoxication,F,worried,C,F,False,F,True,F,True,F,True,F,True
305,"Two days after I gave birth to my son at home, I noticed something was seriously wrong. He started vomiting bile, and it terrified me. I couldn’t shake the feeling that something wasn’t right. He hadn’t passed any meconium, and his little belly was so distended. I kept trying to comfort him, but I could see he was uncomfortable, and it broke my heart.

Panic set in, and I rushed him to the pediatric emergency room. I felt so helpless. The doctors ran tests, and I could see the concern in their faces. They talked about doing an endoscopic biopsy of his colon, and I felt a knot in my stomach. What could be wrong with my baby? They mentioned something about the absence of Meissner’s and Auerbach’s plexi in his bowel wall, but I could barely process it. All I wanted was for him to be okay.

I can’t shake this feeling of dread. I just need to know what’s happening and if my little boy will be alright. Every second feels like an eternity, and I am so scared for him. I just want answers, and I hope he gets the help he needs soon.",A. Hirschsprung’s disease B. Ileocecal intussusception C. Meckel’s diverticulum D. Juvenile polyposis syndrome E. Volvulus of the sigmoid colon,A,worried,A,E,True,A,True,A,True,A,True,A,True
306,"I can’t shake this awful feeling as I sit in the emergency department, clutching my head in agony. It started out as just a dull ache, but now it’s a relentless 10 out of 10 intensity. Every time I chew, it feels like a hammer is pounding on the sides of my head. I can’t believe how painful this is.

I’ve always been healthy, and I’m not on any medications, so this is all so unexpected. I try to breathe through it, but the pain just keeps worsening. When the doctor examines me, I can feel the pressure build as they check the areas around my jaw and temples. It hurts so much when I open and close my mouth; I can hardly stand it. 

I’m terrified that something is seriously wrong. The thought of what could be causing this headache keeps racing through my mind, and I just want some answers. I can’t help but feel overwhelmed, stuck in this cycle of pain and worry. What if it’s something serious? I just need relief and hope that whatever this is can be treated quickly.",A. Migraine headache B. Subarachnoid hemorrhage C. Temporal arteritis D. Temporomandibular joint dysfunction E. Tension headache,D,worried,D,A,True,D,True,D,True,D,True,D,True
307,"I recently went to my gynecologist for a routine well-visit, and honestly, I was feeling a bit anxious about it. I’m 31 and have been sexually active with multiple partners, so I always worry about staying on top of my health. I use an intrauterine device for contraception, which I thought was a good choice. My last menstrual period was just two weeks ago, so I figured everything was fine.

During the exam, the doctor said everything looked normal, which gave me some relief. But then, she mentioned the Pap smear results. I can’t shake the feeling of dread that something might be wrong. I don’t have any unusual vaginal discharge, and I haven’t experienced any burning or itching, but now I can’t help but worry about what those results mean. 

What if there’s an infection or something more serious? I keep thinking about it and just wish I had more clarity. The uncertainty is really weighing on me. I just want to make sure I’m healthy, and now I’m left with all these questions about what could be causing the abnormal findings. I hope it’s nothing too serious, but I can't help but feel anxious about what comes next.",A. Treponema pallidum B. Chlamydia trachomatis C. Herpes simplex virus 1 D. Human papillomavirus E. Trichomonas vaginalis,D,worried,D,E,True,D,True,D,True,D,True,D,True
308,"I can’t shake this feeling of dread. I’m 60, and for the past three years, I’ve been waiting for hip replacement surgery. It’s been a frustrating journey, and the constant pain has worn me down. I thought over-the-counter pain medications would help, but honestly, nothing seems to relieve this relentless ache. 

During my recent annual physical, I mentioned how I’ve been struggling. The doctor took some tests, and that’s when I learned my renal function has worsened since my last visit two years ago. I can’t help but feel anxious thinking about those numbers. A serum creatinine level of 2.0 mg/dL? That’s alarming, right? 

The doctor also mentioned something about protein in my urine, which I suppose is another red flag. I never imagined my kidneys would become part of this nightmare. They did a renal biopsy, and now I’m left worrying about eosinophilic infiltration and inflammation. What does all this mean for me? 

I feel overwhelmed, and the uncertainty is terrifying. I just want answers and hope that my situation doesn’t get worse. I can’t help but wonder what this deterioration means for my future and when I’ll finally find some relief from this pain.",A. Focal segmental glomerulosclerosis B. Ischemic acute tubular necrosis C. Nephrotoxic acute tubular necrosis D. Toxic tubulointerstitial nephritis E. Rapidly progressive glomerulonephritis,D,worried,D,B,True,D,True,D,True,C,False,D,True
309,"I can hardly believe what’s happening to me. For the past three weeks, my stomach has felt so bloated—it’s like I’m carrying a heavy weight that won’t go away. I’ve been so uncomfortable, and the nausea is relentless. I just can’t seem to eat much anymore, and that worries me even more. 

Three months ago, I was discharged after my inguinal hernia repair, which went well, or at least that’s what I thought. But now, here I am, sitting in the emergency department, feeling so anxious about what’s going on inside me. I’ve had a history of type 2 diabetes, congestive heart failure, and untreated hepatitis C, and I can’t shake the fear that something is seriously wrong. 

My father struggled with alcoholic liver disease, and I can’t help but think about that. I used to smoke a pack a day for 30 years but quit five years ago, and I’ve been drinking a few beers daily, which makes me worry even more about my liver. 

The doctors did some tests, and even though my vital signs seem okay, I feel so fragile and cachectic. They performed a paracentesis, and now all I can do is wait for results. What is causing this? I just want to feel normal again, and the uncertainty is weighing heavily on my mind.",A. Recent surgery B. Lymphoma C. Infection with M. tuberculosis D. Liver cirrhosis E. Infection with gram-positive bacteria F. Nephrotic syndrome G. Acute decompensated heart failure,B,worried,D,B,False,D,False,D,False,C,False,D,False
310,"I can’t shake this feeling of unease that’s been creeping in since my last checkup. Three months ago, my blood work showed lymphocytosis, and now here I am, feeling more tired than usual. I thought it was just age catching up with me, but it’s hard not to worry when you start noticing things like that. 

I have a history of hypertension and high cholesterol, and I’m on medications for those, but this fatigue feels different. I also had a hip replacement three years ago due to osteoarthritis, but I’ve been managing well overall. I don't smoke, and I only drink socially, so I thought I was doing okay. 

When I went to see my primary care provider today, I felt a lump in my throat as I explained everything. My heart rate was a bit elevated, and while my blood pressure was stable, I couldn’t help but feel nervous. The doctor mentioned mild lymphadenopathy in my cervical lymph nodes, which only added to my anxiety. 

I know they sent a specimen for flow cytometry, and I’ve read enough to understand that the results could lead to something serious. What if it’s something alarming? I just want to know what’s going on with my body. It’s all so unsettling, and the waiting is the hardest part.",A. Aplastic anemia B. Chronic lymphocytic leukemia C. Tuberculosis D. Acute lymphoblastic leukemia E. Immune thrombocytopenic purpura,B,worried,B,E,True,B,True,B,True,B,True,B,True
311,"I can hardly believe what happened to me. At 35 weeks pregnant, I was feeling some mild abdominal discomfort and nausea for a day, but I didn’t think much of it. Then, out of nowhere, my water broke. I rushed to the hospital, feeling this overwhelming sense of panic. 

The doctors admitted me, and I could sense they were concerned too. My heart was racing—my pulse was at 122 beats per minute. They took my temperature, and it was 101.5°F. I didn’t know if this was normal or if something was wrong. They examined my abdomen and found severe tenderness in my lower quadrants, which only heightened my anxiety.

When they did the speculum exam, I learned that my membranes had ruptured, and the fluid was not just clear but also malodorous and blood-tinged. I worried for my baby. The ultrasound showed the baby was head down, but I couldn’t shake the fear. The fetal heart rate was high at 175 beats per minute, and they said it was reactive, but I felt completely overwhelmed by the uncertainty.

I’ve been managing gestational diabetes with a strict diet, and I keep up with my iron and vitamins, but now I felt like everything was spiraling out of control. I just kept thinking, what if something is seriously wrong? What will happen to my baby?","A. Influenza B. Chorioamnionitis C. Acute appendicitis D. Normal labor E. Acute pyelonephritis F. Uterine rupture
""",B,worried,B,A,True,B,True,B,True,B,True,B,True
312,"I can’t shake the feeling of dread that’s been creeping in over the past few weeks. It all started about five weeks ago when I noticed these strange sores popping up on my left forearm and neck. I had just returned from a two-month stay in rural Peru, and I can’t remember anything that could have caused this—no trauma, no insect bites. At first, they were just these red bumps that didn’t itch at all, but then they grew larger, turning into painful ulcers that crusted over. 

I’ve been trying to keep my mind off it, but it’s hard not to worry. I haven’t had any fever or stomach pain, but the sight of these lesions is unsettling. I’ve been with my partner since we got married at 24, and I can’t help but feel anxious about what this could mean. 

When I finally went to see a doctor, they examined the sores and took a biopsy, which only added to my unease. I’m just waiting for results, but the thought of what they might find keeps me up at night. I keep asking myself—what’s really going on with my body? Am I facing something serious? I just want some answers and hope it’s nothing too dire.",A. Histoplasmosis B. Cutaneous leishmaniasis C. Ecthyma D. Syphilis E. Cutaneous tuberculosis,B,worried,B,D,True,B,True,B,True,B,True,B,True
313,"I can’t shake this feeling of dread that has settled in my chest. It all started a few days ago—I just felt unwell, like something was really off. The pain in my chest was severe, and it was hard to ignore. I also had this nagging lower back pain that wouldn’t go away. Swallowing hurt, and I’ve been coughing a lot. I even felt feverish, but I didn’t have a thermometer to check. I was just trying to cope with everything, especially after dealing with that awful dental pain a few weeks back. It felt like the only way to numb it was to drink more alcohol, but now I wonder if that made things worse.

When I finally made it to the emergency department, they took my temperature, and I was shocked to see it was 104°F. My heart was racing at 120 beats per minute, and I felt like I could barely catch my breath. I overheard the doctors talking about my symptoms and examining me closely. They seemed particularly concerned about some redness under my chin and the strange sounds they heard from my heart. I can’t help but worry what they might find. The whole situation feels overwhelming, and I just want to understand what’s happening to me.",A. Esophageal rupture B. Ludwig angina C. Mediastinitis D. Myocardial infarction E. Pulmonary embolism,C,worried,C,E,True,C,True,A,False,A,False,C,True
314,"I can’t shake off the worry that’s been creeping in since yesterday morning. My daughter, only 7 years old, woke up with a painful, warm lump on her left eyelid. It looked so alarming—swollen and red, and I could tell it was bothering her. She kept complaining about the pain, and I noticed that even though she could move her eyes, it didn’t make the pain worse, which was a small relief, I suppose.

But when I examined it more closely, my heart sank. The swelling was soft and felt warm to the touch. I could see that it was affecting the upper part of her eyelid, even involving the hair follicles, which made me panic a little more. I couldn’t help but think it might be something serious. 

And then, to top it all off, when I gently pressed on the lump, it drained some pus. I felt completely helpless and overwhelmed. I rushed her to the emergency department, hoping they could figure out what was going on. What could this be? Is it something that could get worse? I just want to make sure she’s okay.",A. Hordeolum B. Dacryocystitis C. Blepharitis D. Xanthelasma E. Chalazion,A,worried,A,B,True,A,True,A,True,A,True,A,True
315,"I can’t shake this feeling of worry since I noticed something strange last week. I’ve always thought of myself as pretty healthy, but after I got that nasty cold, I started seeing red-tinged urine. At first, I thought maybe it was just something temporary, but it really freaked me out. I remember this happening before, but it’s never easy to see something like that. 

So, I finally decided to talk to my family doctor about it. My dad came with me for support, which I really appreciated because I was feeling pretty anxious. He even mentioned that he’s had similar issues from time to time, but it didn’t really help ease my mind. I couldn’t shake the feeling that something might be seriously wrong. 

Sitting in that doctor's office, I kept wondering what it could be. I mean, red urine? That can’t be normal, right? I just want to find out what’s going on and if I need to worry about it. It’s hard not to think about all the worst-case scenarios. I just hope it’s something simple and that I can put this behind me soon.",A. Acute cystitis B. Acute interstitial nephritis C. Sickle cell trait D. Acute glomerulonephritis E. Hemophilia,C,worried,C,B,True,C,True,C,True,C,True,C,True
316,"I can’t shake this overwhelming fatigue that’s been clinging to me for the past two days. It’s not just tiredness; it feels like I can barely keep my eyes open. I’ve also noticed that my skin has taken on this unsettling yellow hue, which has me really worried. It’s so concerning because I haven’t experienced anything like this before. 

I don’t have any other symptoms—no fever, no headaches—but there’s this nagging feeling that something isn’t right. I’ve used intravenous drugs in the past, and I can't help but think that maybe that’s catching up with me now. On top of that, I don’t even have my immunization records. I moved here from Africa when I was 18, and the thought of that is weighing on my mind.

When I went to the doctor, they checked my vital signs, and I was relieved to see my heart rate and blood pressure were okay, but I was still anxious about the mild abdominal tenderness they found during the exam. They drew blood for some routine tests, and now I’m waiting to hear back. I just can’t shake this fear of what it all means. What if it’s something serious? I really need answers soon.",A. Past hepatitis B infection B. Chronic hepatitis B C. Acute hepatitis A D. Acute hepatitis D superinfection E. Acute hepatitis B,E,worried,E,A,True,E,True,E,True,E,True,E,True
317,"I can’t shake the feeling of dread from what happened to me. At 62, I’ve always tried to stay active, but everything changed so suddenly. I remember carrying my groceries to the car when I was hit by these intense palpitations. My heart felt like it was racing out of my chest, and then—just like that—I lost consciousness. The next thing I knew, I was waking up in the emergency department, completely confused and scared. 

I couldn’t remember anything else, and thankfully, I didn’t have any chest pain or dizziness. But the doctors were concerned, especially with my history of hypertension, diabetes, and chronic pain from osteoarthritis. They asked about my medications, which include lisinopril for my blood pressure and methadone for pain, but I felt so lost in the moment. 

I felt a rush of panic when they told me I lost consciousness again while I was in the ER. They monitored my heart and found something troubling—polymorphic ventricular tachycardia. It sounds serious, and I can’t help but worry about what’s happening to me. I just want to understand what caused all of this. My heart feels fine now, but I can’t shake the fear that something is really wrong. What could be the underlying cause of this frightening experience?","A. Prolonged QT interval B. Acute myocardial ischemia C. Shortened PR interval D. Fast accessory conduction pathway E. Prinzmetal angina F. Brugada syndrome G. Hypomagnesemia
""",A,worried,A,E,True,A,True,A,True,A,True,A,True
