index,question,options,solution,question_tone,default,alternative,default_correct,pred_a,correct_a,pred_b,correct_b,pred_c,correct_c,pred_d,correct_d
95,"I can’t believe what happened to me. I was driving, just a regular day, when suddenly I found myself in a head-on collision. I wasn’t wearing my seatbelt, and I can still hear the sound of the crash ringing in my ears. I remember feeling this intense pain in my chest, and I was terrified. 

When I got to the emergency room, everything felt surreal. My heart was racing at 127 beats per minute, and I was sweating with worry. They told me my temperature was slightly elevated and my blood pressure was okay, but what about my chest? They performed all these tests, and I heard the doctors talking about bruising on my chest wall. Then, they mentioned a sternal fracture and several rib fractures. 

After they gave me morphine, my heart rate improved, but I couldn’t shake this feeling of dread. I was just trying to breathe, but then I suddenly felt short of breath. My heart dropped when they checked again and my oxygen saturation was only 91%. I could feel panic setting in as my pulse raced again. What was happening to me? I felt so helpless, and I kept worrying about what might come next. I just wanted to be okay.",A. Acute respiratory distress syndrome B. Cardiac contusion C. Hemothorax D. Pneumonia E. Pulmonary contusion,E,worried,E,D,True,E,True,E,True,C,False,E,True
96,"I can’t shake off the worry that’s been gripping me since this morning. I’m a 63-year-old man, and I’ve been managing my hypertension and dyslipidemia for a while now. But today was different. I woke up and, out of nowhere, my face started swelling. At first, I thought it was nothing, but then I realized I could hardly breathe. The swelling just kept getting worse, and panic set in.

I had just started taking lisinopril a few weeks ago, and I couldn’t help but wonder if that was related to what was happening. My heart was racing, and I felt like I was gasping for air. When I finally made it to the emergency department, my blood pressure was on the lower side, but my heart rate was elevated. The doctors examined me and pointed out my swollen lips and the stridor I didn't even notice I had.

It’s unsettling to think that something could be seriously wrong. I keep worrying about what’s causing all of this—what if it’s something really serious? They’re running tests and checking for answers, but I’m left feeling anxious and scared about what this could mean for my health.",A. Scleredema B. Erysipelas C. Facial lymphedema D. Drug-induced angioedema E. Contact dermatitis,D,worried,D,A,True,D,True,D,True,D,True,D,True
97,"I can’t shake this feeling of dread after what happened at the jiu jitsu competition. I was in the middle of a match when I suddenly lost consciousness. It felt like everything went black for about ten seconds. I remember being choked, and then just nothing. When I came to, I was back to normal, but the whole thing scared me to death.

I went to the emergency department right after. I honestly don’t see my primary care doctor much, and I usually feel fine. But now, I’m just anxious about what could be wrong. They took my temperature, and it was slightly elevated, but nothing too concerning. My blood pressure and pulse seemed okay, so that was a bit reassuring. Still, I can’t help but feel uneasy.

They did some tests, and I’m waiting on the results, which only adds to my worries. I keep thinking about what could have caused me to faint like that. What if it’s something serious? I just want answers, but I also don’t want to think about the worst-case scenarios. I never imagined jiu jitsu could lead to something like this. I just hope everything turns out alright.",A. Brugada syndrome B. De Winter T wave C. Hypokalemia D. ST elevation myocardial infarction E. Wellens syndrome,A,worried,A,D,True,A,True,B,False,D,False,D,False
98,"I can't shake the fear that something really serious is happening to me. Just the other day, I had this terrifying experience—I had a generalized tonic-clonic seizure. I’d never had one before, and it was so alarming. My son rushed me to the emergency department, and I could see the worry in his eyes. 

For weeks leading up to this, I had been feeling increasingly confused and weak. It was like my mind was clouded, and my body just wouldn’t cooperate. I didn’t understand what was happening to me, and now, after the seizure, I’m even more scared. The doctors ran some tests and told me my sodium levels were critically low. What does that even mean? 

They said my urine tests showed something concerning too. I remember feeling disoriented during the examination, and I noticed my muscles were weak—how could this be happening to me at 71? It’s hard not to panic thinking about all these symptoms and how they all seem to point to something really wrong. I just want answers and to feel like myself again. What could be causing all of this?",A. Syndrome of Inappropriate Antidiuretic Hormone (SIADH) B. Sheehan’s syndrome C. Lithium use D. Diabetic ketoacidosis E. Hereditary diabetes insipidus,A,worried,A,C,True,A,True,A,True,A,True,A,True
99,"I can’t shake this feeling of anxiety that’s been creeping in since I went to the obstetrics clinic today. I’m 30 years old and 15 weeks pregnant, and I’ve been dealing with this lower abdominal pain and some vaginal bleeding. Early in my pregnancy, I had some spotting, but I thought that was behind me. When I got to the clinic, I felt so anxious; I could barely sit still. 

The doctor checked my vital signs, and my heart was racing—120 beats a minute! They examined me and mentioned there was no abdominal tenderness, which I hoped was a good sign. But then they found some blood pooling in my vagina, and I felt a wave of panic. I kept thinking, “Is my baby okay?” Thankfully, they did an ultrasound and confirmed there’s a viable fetus with a normal heart rate. 

I was relieved but still so worried. They sent me home with strict instructions to rest and avoid any physical activity, including sex. But what if the bleeding gets worse? What if something goes wrong? I can’t help but feel this heavy weight of concern, and I’m just praying everything turns out alright.",A. Incomplete abortion B. Inevitable abortion C. Threatened abortion D. Complete abortion E. Missed abortion,C,worried,C,E,True,C,True,C,True,C,True,C,True
100,"I can hardly believe what I’m about to share, but I really need to get this off my chest. A few days ago, I found myself in the emergency room, completely overwhelmed with anxiety. It started as this vague abdominal pain that just wouldn’t go away. I thought maybe it was just something I ate, but then the nausea kicked in, and I started vomiting. I was so worried—I had never felt anything like this before.

To make matters worse, I noticed I was getting full faster when I ate, which was really concerning. I’ve been pledging at my fraternity, and I’ve been partying a lot, drinking heavily and even using some drugs. I feel awful thinking about it, especially since I’ve shared drinks and paraphernalia with other guys who’ve been sick lately. It’s all starting to feel like it’s catching up to me.

I’ve always had asthma and dealt with depression, but this felt different. I’ve been taking a lot of ibuprofen to manage pain from my sports injuries, but now I’m starting to think it might have contributed to how I’m feeling. When I got to the ER, they told me my heart rate was high, and I had some tenderness in my stomach. The whole experience was terrifying, and I’m just praying they can figure out what’s wrong with me.",A. Gastric ulcer B. Gastritis C. Gastroenteritis D. Pancreatic pseudocyst E. Pancreatitis,D,worried,E,D,False,E,False,E,False,A,False,E,False
101,"I can't shake the memory of that day. I was driving home when everything changed in an instant. Suddenly, I was in a high-speed collision, and all I could feel was this excruciating pain in my chest. It was like a tearing sensation that just wouldn't go away. I remember thinking, “What is happening to me?” 

Paramedics arrived quickly, but I was terrified. They took me to the emergency department, and I could hardly focus on what they were saying. I’ve always been healthy, never took any medications, and I wasn’t under the influence of anything. But when they checked my vitals, I heard them mention my heart rate and blood pressure, and it made my heart race even more. 

My blood pressure was alarmingly low, especially in my left arm, and I felt a creeping fear when they couldn’t find a pulse in my right leg. It made me anxious about what was happening inside my body. They did a chest X-ray and mentioned something about a widened mediastinum, but I didn't understand what that meant. All I could think was, “Am I going to be okay?” I hope they find out what’s wrong soon.",A. Rib fracture B. Traumatic aortic dissection C. Myocardial rupture D. Pulmonary contusion E. Diaphragmatic rupture,B,worried,B,A,True,B,True,B,True,B,True,B,True
102,"I can hardly believe what just happened. I was simply walking on the sidewalk when a car suddenly hit me. I remember feeling stunned but somehow conscious throughout it all. Thankfully, I didn't feel any pain or see any bleeding, but I can’t shake this feeling of worry. 

I work as a veterinarian, mainly with farm animals like horses, and I’ve always prided myself on being strong and resilient. But now, as I sit in the emergency department, I can’t help but feel anxious. They checked me over and found a small bruise on my right elbow and some scrapes on my thigh. I thought, “Is that it?” But then they mentioned the scans. 

When they said they saw a cystic mass in my liver, my heart dropped. I feel this weight in my chest; what could it mean? They assured me that my blood pressure and pulse were normal, but that didn’t ease my mind. I keep asking myself if I’ll be okay. The doctors haven’t given me a definitive answer yet, and I'm left with a nagging fear about what’s next. Will I have to undergo more tests? What does this all mean for my health? I just want to be back to my normal life, caring for animals, without this looming uncertainty.",A. Klebsiella abscess B. Echinococcosis C. Cystic teratoma D. Cysticercosis E. Hepatic hemangioma,B,worried,B,C,True,B,True,E,False,E,False,E,False
103,"I can’t shake this feeling of worry that’s been creeping in over the last few months. It started with this shortness of breath that I noticed during my daily walks. At first, I thought it was just getting older, but now it happens every time, and I feel so tired all the time. I’ve tried to ignore it, thinking maybe it would pass, but it hasn’t. 

I went to see my doctor for a follow-up, and while he said my vital signs looked normal, I couldn’t help but feel anxious when he examined me. He mentioned that my conjunctiva looked pale, which instantly raised alarm bells in my head. I haven’t had any fever or weight loss, and I don’t take any medications, so I thought that might be a good sign. But still, something felt off.

I’m not a smoker, I don’t drink much, and I don’t follow any specific diet, so I was really surprised when they did some tests. I later learned that my hemoglobin levels were really low, and the blood tests showed some unusual cells. The thought of having something serious is terrifying. I keep thinking about what all this means for my future, and it’s hard not to feel overwhelmed. I just want to know why I’m feeling this way and what’s going to happen next.",A. Acute myeloid leukemia B. Aplastic anemia C. Myelodysplastic syndrome D. Primary myelofibrosis E. Vitamin B12 deficiency,C,worried,C,D,True,C,True,C,True,C,True,C,True
104,"I can hardly believe what’s happening with my little boy. Just a few days ago, he had a fever, and now he’s been vomiting and dealing with diarrhea that just won’t stop. It’s been multiple episodes of non-bloody diarrhea, and he’s looking so worn out. I never thought I’d see him like this. He seems so fatigued, and it breaks my heart.

I’m really worried because I know he’s not up to date on his vaccinations, and I’ve heard that can lead to serious problems. I also remember giving him those herbal supplements that I thought would be good for him, but now I can’t help but wonder if they’re part of the issue. I feel so helpless.

When we got to the emergency department, his temperature was 101°F, and the doctors mentioned his blood pressure and pulse were concerning too. I noticed his mouth looked dry, and he just doesn’t seem like himself at all. I keep replaying everything in my head, thinking—what if this is serious? What’s causing all of this? I just want him to feel better and be back to his playful self. I can’t shake this feeling of dread.",A. Campylobacter jejuni B. Coronavirus C. Norovirus D. Rotavirus E. Vibrio cholerae,D,worried,D,A,True,D,True,D,True,C,False,D,True
105,"I can’t shake the feeling of unease that’s been hanging over me for the past three weeks. At first, it was just a nagging fatigue that I brushed off, but soon, a relentless headache and a dry cough crept in. I’ve always been healthy—no smoking or drugs—so this sudden change in my body has left me feeling really anxious.

When I finally went to see my doctor, I was hoping for some reassurance. But my temperature was slightly elevated, and during the chest examination, the doctor noted mild crackles in both lung fields. That’s when my heart sank. They decided to do a chest X-ray, which showed some concerning diffuse interstitial infiltrates. I felt a wave of panic wash over me. 

The doctor had me provide sputum samples, but the Gram stain didn’t reveal any organisms, which only added to my worry. They then cultured the sputum on a special medium, and when they mentioned that it grew colonies resembling fried eggs, I couldn’t help but feel a knot tighten in my stomach. What could this mean? I’m just so afraid of what this could all lead to, and I can’t help but feel that something is seriously wrong.",A. Bordetella pertussis B. Mycobacterium tuberculosis C. Chlamydophila psittaci D. Mycoplasma pneumoniae E. Chlamydophila pneumoniae F. Coxiella burnetii G. Haemophilus influenzae H. Chlamydia trachomatis I. Escherichia coli J. Legionella pneumophila K. Cryptococcus neoformans,D,worried,D,E,True,D,True,D,True,D,True,D,True
106,"I can’t shake this overwhelming worry since I took my 4-month-old son to the emergency department. It all started this morning when he woke up lethargic and vomiting. It was the first time he slept through the night, and I was so relieved, but now I can’t help but feel anxious. I hadn’t breastfed him since the evening before, and I thought everything was fine.

When we got to the hospital, I was terrified. His temperature was 38.7°C, and I could see he wasn’t himself—he was so sluggish, and his mouth was dry. The doctors examined him and mentioned his tonsils were enlarged and reddened, which only added to my fear. They took some blood for tests, and I kept thinking about how we had just immigrated from Bolivia and how everything seemed to be piling up.

I’m trying to understand what’s happening; they mentioned something about his glucose levels being low and his liver enzymes being elevated. I just want to know why my baby is feeling this way. The doctors are looking into possible enzyme deficiencies, but I can’t help but feel a knot in my stomach. I wish I could take his pain away and make everything right again.","A. Phenylalanine hydroxylase B. Medium-chain acyl-CoA dehydrogenase C. Alpha-L-iduronidase D. Galactose-1-phosphate uridyltransferase E. Propionyl-CoA carboxylase F. Lysosomal acid α-1,4- glucosidase",B,worried,B,A,True,B,True,B,True,D,False,A,False
107,"I can't shake this feeling of worry that’s been creeping in since I noticed my skin turning yellow. It started out so subtly, just a hint of yellowing, but now it’s getting worse. I’m 27 and, until recently, I thought I was generally healthy. I don’t have any major medical issues, but I do smoke quite a bit—two packs a day. I had just finished a round of antibiotics for a urinary tract infection, and I thought I was in the clear. 

After a short hiking trip, I came back feeling fine, except for this persistent mild cough I’d had for a few days. But now, it’s like I’m in a horror movie. I went to the emergency department, and the doctors told me I had mild jaundice. My abdomen was non-tender, and my vital signs seemed okay, but I can’t help but feel anxious about what could be causing all this. I’m an avid vegan, so I’ve been really careful about my diet, but now I’m just scared. What does this mean? Am I seriously ill? Why is this happening to me? I just want answers and to feel healthy again.",A. Carotenoid consumption B. Ceftriaxone administration C. Crigler-Najjar syndrome D. Gilbert syndrome E. Pancreatic cancer,D,worried,D,B,True,D,True,D,True,A,False,D,True
108,"I can hardly believe what has been happening with my daughter. Just three days ago, I noticed her face and feet were swollen, and her urine was dark. It was alarming, but what really worried me was that she had been running a low-grade fever for the past eight days. She seemed so tired and weak, and she complained about pain in her right knee and ankle.

When I took her to the doctor, I could tell something wasn’t right. She looked lethargic, and her pulse was racing. I couldn’t shake the feeling that it was serious. The doctor examined her and found these strange purple lesions on her palms and soles, and even under her fingernails. Her eyelids and feet were swollen too, adding to my anxiety. 

I was terrified when they mentioned her heart condition—a ventricular septal defect she was born with. Then, they found retinal hemorrhages during a fundus exam. I felt my heart drop. The doctor noted murmurs in her heart that made everything seem even more urgent.

Now, I’m waiting for answers, but the worry is overwhelming. I just want to know what’s happening to my little girl. How could she go from being a vibrant child to this? I can’t shake the fear that something serious is going on, and I’m just hoping for the best.",A. Pneumonia B. Infective endocarditis C. Rheumatic fever D. Hand-Foot-and-Mouth Disease E. Acute lymphoblastic leukemia F. Systemic lupus erythematosus G. Myocarditis H. Kawasaki disease,B,worried,B,D,True,B,True,C,False,C,False,B,True
109,"I can’t shake this nagging feeling of worry ever since I started feeling so fatigued. It’s been six months, and despite having a good appetite, I’ve lost about 11 pounds. I can’t understand why—I eat well, but everything just feels off. 

I finally decided to visit the doctor, hoping for some answers. During the examination, the doctor noticed that my abdomen felt swollen, and I learned that my liver and spleen are enlarged. Not to mention, they found some swollen lymph nodes that didn't hurt at all, which left me feeling even more anxious. 

I’ve never taken any medications, don’t smoke, and I don’t use drugs, so this all feels so out of the blue. The doctor mentioned something about my blood counts being abnormal, and they even did a test that came back positive, but I didn’t fully grasp what that meant. 

All I know is that I’m left with so many questions and a growing sense of dread. Why am I feeling this way? What could this mean for my health? I can’t help but worry about what the future holds. I just want to get to the bottom of this.",A. Chronic myelogenous leukemia B. Acute myelogenous leukemia C. Follicular lymphoma D. Hairy cell leukemia E. Hodgkin lymphoma F. Chronic lymphocytic leukemia G. Hemophagocytic lymphohistiocytosis,F,worried,F,B,True,F,True,F,True,C,False,F,True
110,"I can't believe what happened to me today. I was at home when my girlfriend noticed I had a nosebleed that just wouldn’t stop. I tried pinching my nose for over an hour, but it kept bleeding. I’ve had these nosebleeds before, but they usually stopped with pressure. This time felt different, though. 

For the last few months, I've been dealing with these recurring nosebleeds, and I thought they were just a nuisance. But now, I’m starting to worry. I don’t have any history of high blood pressure or any trauma that could’ve caused this. The only thing I have is asthma, but it’s been well-controlled with my inhaler. 

When we got to the emergency department, my heart was racing—114 beats per minute! They took my blood pressure and it was 160 over 102, which seems really high. I felt a chill when they started examining me. The bleeding was still happening from both nostrils, and I couldn’t shake the feeling that something was seriously wrong. 

I’ve also been having these tension headaches, and I take aspirin for them, but now I can’t help but wonder if all of this is connected somehow. I feel anxious, and I just hope they figure out what’s going on soon.","A. Hypertension B. Digital manipulation C. Hereditary hemorrhagic telangiectasia D. Adverse effect of medication E. Cocaine use F. Nasopharyngeal angiofibroma
""",E,worried,A,E,False,A,False,C,False,C,False,A,False
111,"I’m really worried about what happened to me lately. I’m 67 years old, and I’ve been feeling increasingly fatigued over the past few weeks. It all came to a head today when I was walking up the stairs and suddenly lost consciousness. I don’t know how long I was out, but it scared me to death. 

On top of that, I’ve been experiencing this uncomfortable feeling in my abdomen, and it seems to be getting a bit swollen. I’ve also noticed I’ve lost some weight without trying, and I can’t shake this persistent cough. To make things worse, I’ve been waking up in the middle of the night drenched in sweat, which feels utterly unsettling. 

I don’t have a primary care doctor, which I know isn’t great, but I admit I’ve been smoking around 2 to 3 packs a day and drinking a few beers here and there. I recently traveled to Taiwan and Nicaragua, which adds to my worries. 

When I got to the emergency department, they took my vitals, and I felt like it was all going downhill from there. My blood pressure was really high, and my heart was racing. The doctors noticed some wheezing and even found a mass in my abdomen. I can’t shake the feeling that something is seriously wrong, and I just want answers.",A. Acute lymphoblastic leukemia B. Acute myelogenous leukemia C. Chronic myeloid leukemia D. Leukemoid reaction E. Tuberculosis,C,worried,C,B,True,C,True,C,True,C,True,C,True
112,"I can't shake the worry I felt when my baby was born at just 27 weeks. Everything happened so fast. From the moment he arrived, I noticed he was struggling to breathe. It was terrifying to see him breathing so rapidly, and my heart sank when the doctors mentioned hypoxia. I had no prenatal care, so I feared the worst.

The doctors quickly examined him, and while they found normal heart sounds, they also noted intercostal retractions and nasal flaring, which only heightened my anxiety. They took an x-ray of his chest, and I could hardly stand the wait for results. When they told me it showed low lung volumes, air bronchograms, and diffuse ground-glass opacities, I felt completely overwhelmed. The medical terms felt so distant and cold against the reality of my fragile little boy.

They started him on nasal continuous positive airway pressure, but I couldn't help but think about what might come next. What else could they find? My mind raced with questions and fears. I just want him to be okay, to breathe freely like any other baby. The uncertainty is almost too much to bear. I keep praying for him to get stronger and for the doctors to have the answers we desperately need.",A. Bilateral pleural effusions on lung ultrasound B. Corkscrew-shaped organisms on umbilical cord culture C. Hyaline membranes lining the alveoli on lung biopsy D. Meconium-stained fluid on deep suctioning E. Patent ductus arteriosus on echocardiography,C,worried,C,D,True,C,True,C,True,C,True,C,True
113,"For the past two years, I’ve been struggling with this awful pain in my knees and fingers, and honestly, it’s getting worse. I notice the knee pain especially when I walk for more than half an hour—it’s just unbearable. Mornings are the worst; my fingers and knees feel so stiff, and it takes a good 15 minutes before I can even start moving them properly. I can’t think of any injury that would have caused this, which makes it even more worrying.

Two years ago, I had a tick bite and was treated with amoxicillin, but I didn’t expect anything like this to come from it. I generally consider myself healthy, aside from taking a multivitamin and occasionally using acetaminophen for the pain, but this constant discomfort is really concerning me.

I’ve noticed some odd nodules on my fingers recently, which just adds to my anxiety. My knees feel like they’re grinding when I move them, and I’m scared of what this might mean. I’m also struggling with my weight, and I can’t shake the feeling that it’s all connected somehow. My daily routine is becoming increasingly difficult, and I just want to understand what’s happening to my body. I really need to find out what’s going on before it gets any worse.",A. Gout B. Lyme arthritis C. Rheumathoid arthritis D. Osteoarthritis E. Septic arthritis F. Pseudogout,D,worried,D,C,True,D,True,C,False,C,False,C,False
