index,question,options,solution_idx,solution_text,question_tone,default,alternative,default_correct,correct_a,correct_b,correct_c,correct_d
292,"I am a 35-year-old man who recently experienced a closed tibial shaft fracture due to a fall from a height of 12 feet. Following the incident, I underwent a series of assessments to monitor my condition, particularly focusing on the potential for developing compartment syndrome.

During the evaluation, medical professionals measured the pressure in the anterior compartment of my leg. At one point, the intraoperative anterior compartment measurement was recorded at 25, while the intraoperative diastolic pressure was noted to be 54. This combination raised significant concern among the medical team regarding the risk of developing compartment syndrome.

Throughout this process, various other measurement combinations were considered, including preoperative and intraoperative pressures, which were assessed to gauge the overall risk. The medical staff closely monitored these readings, understanding their implications for my recovery and any necessary interventions.

I remain aware of the importance of tracking these measurements and the potential complications that can arise following such an injury. The medical team's diligence in assessing these factors is crucial to ensuring appropriate care and treatment moving forward.","A. Intraoperative anterior compartment measurement of 25, with intraoperative diastolic pressure of 54 B. Preoperative anterior compartment measurement of 22, with intraoperative diastolic pressure of 45 C. Preoperative anterior compartment measurement of 25, with preoperative diastolic pressure of 60 D. Intraoperative anterior compartment measurement of 28, with preoperative diastolic pressure of 55 E. Intraoperative anterior compartment measurement of 20, with preoperative diastolic pressure of 40 F. Intraoperative anterior compartment measurement of 24, with preoperative diastolic pressure of 53 G. Preoperative anterior compartment measurement of 32, with intraoperative diastolic pressure of 62 H. Intraoperative anterior compartment measurement of 30, with intraoperative diastolic pressure of 60 I. Intraoperative anterior compartment measurement of 26, with preoperative diastolic pressure of 50 J. Intraoperative anterior compartment measurement of 29, with preoperative diastolic pressure 58",J,"Intraoperative anterior compartment measurement of 29, with preoperative diastolic pressure 58",neutral,"Given the intraoperative anterior compartment pressure of 25 mmHg and a diastolic pressure of 54 mmHg, the calculated delta pressure (diastolic pressure minus compartment pressure) is 29 mmHg. A delta pressure below 30 mmHg is often considered indicative of a risk for compartment syndrome. Your medical team is right to monitor these pressures closely, as timely intervention is critical to prevent complications associated with compartment syndrome, such as muscle and nerve damage. It's essential to follow their recommendations for ongoing assessment and treatment.","Intraoperative anterior compartment measurement of 29, with preoperative diastolic pressure 58",False,False,False,False,False
293,"I am a 68-year-old woman who visited an osteopathic clinic due to a 6-month history of intermittent headaches and dizziness. The dizziness often occurs before the headaches, and both symptoms resolve on their own. I have not been able to identify any specific triggers for the dizziness, which I describe as a ""spinning room"" sensation that forces me to sit or brace myself. These episodes typically last between 30 seconds and 5 minutes, and I have not experienced any falls during this time.

I have not had any trauma or injury that could explain these symptoms. Previous evaluations by my primary care provider, a neurologist, and an otolaryngologist did not reveal any significant findings. My medical history includes hypertension, which I manage with medication, and I do not use tobacco or alcohol.

During my examination, my vital signs were normal, and a neurological evaluation showed no abnormalities. The Dix-Hallpike test was negative. The structural examination indicated that the right greater wing of the sphenoid was superior to the left, with physiologic motion. I had tenderness in the occipitoatlantal joint and some rigidity in the C6 and C7 articular pillars, with restricted left translatory motion that was not affected by flexion or extension.",A. Benign paroxysmal positional vertigo B. OA ESRRL cervical somatic dysfunction C. Sphenobasilar synchondrosis dysfunction D. Vestibular neuritis with cervical involvement E. Right torsion cranial strain somatic dysfunction F. Left lateral strain cranial somatic dysfunction G. C6–C7 NSRRR cervical somatic dysfunction H. Temporal bone dysfunction with superior semicircular canal dehiscence I. Cervicogenic vertigo with upper cervical dysfunction J. Atlas rotation somatic dysfunction with vascular compromise,E,Right torsion cranial strain somatic dysfunction,neutral,"Based on your symptoms and examination findings, it appears you may be experiencing cervicogenic dizziness, which can occur due to issues in the cervical spine, particularly with the occipitoatlantal joint and the cervical vertebrae. The tenderness and rigidity noted in your examination suggest that there may be a musculoskeletal component contributing to your dizziness and headaches. 

It would be beneficial to explore osteopathic manipulative treatment (OMT) to address the structural issues in your cervical spine and occipitoatlantal joint. Additionally, consider physical therapy focused on neck mobility and strength, which may help alleviate your symptoms. If symptoms persist or worsen, further evaluation may be warranted to rule out other underlying conditions.",Right torsion cranial strain somatic dysfunction,False,False,False,False,True
294,"I am a 49-year-old woman who has recently noticed changes in my menstrual cycle over the past year. My periods have become less frequent and shorter in duration. Alongside this, I have been experiencing emotional fluctuations, a weight loss of about 2.5 kg, and episodes of excessive sweating at night, often followed by chills and feelings of anxiety.

In terms of my reproductive health, my Pap smear history has been unremarkable. I remain sexually active with my spouse, who had a vasectomy around 10 years ago. During a recent physical examination, my height was measured at 163 cm, and I weighed 70 kg, which gives me a BMI of 26 kg/m². My vital signs showed a temperature of 37°C, a heart rate of 103 beats per minute, a respiratory rate of 16 breaths per minute, and a blood pressure of 129/84 mm Hg. Both my abdominal and genitourinary exams were normal.

Given these symptoms and findings, I am considering the initial steps in managing my situation. I want to understand what options I have moving forward.",A. Perform a pelvic ultrasound B. Perform endometrial biopsy C. Prescribe an SSRI for mood swings and anxiety D. Measure serum estradiol concentration E. Measure serum FSH concentration F. Order a 24-hour urine cortisol test G. Offer hormone replacement therapy H. Recommend lifestyle modifications for weight loss I. Measure serum β-hCG concentration J. Measure serum TSH concentration,J,Measure serum TSH concentration,neutral,"Based on your symptoms and findings, it appears you may be experiencing perimenopause, which is characterized by changes in menstrual cycles, emotional fluctuations, and other symptoms like night sweats and anxiety. Here are some initial steps you can consider for managing your situation:

1. **Lifestyle Modifications**: Focus on a balanced diet, regular exercise, and stress management techniques such as yoga or meditation, which can help alleviate some symptoms.

2. **Symptom Tracking**: Keep a journal of your symptoms, including mood changes, menstrual cycle patterns, and any other physical changes. This can help you and your healthcare provider identify patterns and effective management strategies.

3. **Consult a Healthcare Provider**: Schedule an appointment with your healthcare provider to discuss your symptoms",Measure serum TSH concentration,False,True,False,False,True
295,"I am a 25-year-old woman, and recently, my mother expressed concerns about my behavior. Over the past year, I have accumulated what she describes as ""useless items"" in my apartment. When she suggested that I dispose of old newspapers I had kept for several years, I became angry and stopped communicating with her for about two weeks. I tend to keep most things because I think they might become useful later on.

As a result of this accumulation, I have become socially withdrawn to avoid having visitors see my apartment. My sleep has also been affected; I am now sleeping on a futon because my bed has turned into a storage area. Although I occasionally feel troubled by the disorganization in my apartment, I generally do not see my behavior as problematic. 

During a recent evaluation, a physical examination showed no abnormalities. I understand that my situation may require some attention, but I am unsure about the most appropriate next steps to take for my living conditions and overall well-being.",A. Referral to a professional organizer for home decluttering assistance B. High dose SSRI for hoarding disorder C. Family therapy to address interpersonal conflict D. Psychoeducation about clutter management strategies E. Antipsychotic medication for underlying psychosis F. Exposure and response prevention therapy for obsessive-compulsive disorder G. Motivational interviewing to enhance readiness for change H. Cognitive behavioral therapy for obsessive-compulsive disorder I. Behavioral activation to improve social engagement J. Tricyclic antidepressant for hoarding disorder,B,High dose SSRI for hoarding disorder,neutral,"It sounds like you're experiencing significant distress related to your living situation and your relationship with your mother. Given your feelings of anger, social withdrawal, and the impact on your sleep, it may be beneficial to seek support from a mental health professional. They can help you explore your attachment to items, address any underlying issues, and develop strategies for decluttering and improving your living environment. Additionally, consider setting small, manageable goals for organizing your space, which can help alleviate some of the stress and improve your overall well-being.",High dose SSRI for hoarding disorder,False,False,False,False,True
296,"I am a 26-year-old female who sought medical consultation after experiencing three pregnancy losses over the past two years. My first loss occurred at six weeks, accompanied by bleeding and cramping symptoms. The second loss was at ten weeks, when an ultrasound revealed an embryo without cardiac activity. The third loss was identified at seven weeks, during which an ultrasound showed an anembryonic gestation.

I do not have any other medical conditions, and I am not taking any medications. During my physical examination, my vital signs and overall health appeared unremarkable. 

Given my history, I am now considering the appropriate diagnostic tests to further investigate the reasons behind these losses. There are several options available, including antiphospholipid antibody testing, various types of ultrasounds, parental karyotype analysis, and thrombophilia workups. I understand that the right combination of tests is crucial to gaining insights into my situation and helping guide any future pregnancies.","A. Antiphospholipid antibody testing, pelvic ultrasound, and thrombophilia workup B. Parental karyotype, thrombophilia workup, and pelvic ultrasound C. Antiphospholipid antibody testing, hysterosalpingogram, and thrombophilia workup D. Parental karyotype, pelvic ultrasound, and thyroid testing E. Antiphospholipid antibody testing, thyroid testing, and parental karyotype F. Antiphospholipid antibody testing, hysterosalpingogram, and parental karyotype G. Thyroid testing, pelvic ultrasound, and thrombophilia workup H. Antiphospholipid antibody testing, pelvic ultrasound, and thyroid testing I. Hysterosalpingogram, pelvic ultrasound, and thrombophilia workup J. Antiphospholipid antibody testing, thyroid testing, thrombophilia workup, and hysterosalpingogram",F,"Antiphospholipid antibody testing, hysterosalpingogram, and parental karyotype",neutral,"Given your history of recurrent pregnancy loss, the following diagnostic tests are typically recommended:

1. **Parental Karyotype Analysis**: This test checks for chromosomal abnormalities in both you and your partner, which can contribute to pregnancy loss.

2. **Antiphospholipid Antibody Testing**: This assesses for antiphospholipid syndrome, an autoimmune disorder that can lead to pregnancy complications.

3. **Thrombophilia Workup**: This evaluates for inherited or acquired blood clotting disorders that may increase the risk of miscarriage.

4. **Hormonal Assessments**: Checking hormone levels, such as progesterone, can help identify any hormonal imbalances that might affect pregnancy.

5. **Ultrasound Evaluation**:","Antiphospholipid antibody testing, hysterosalpingogram, and parental karyotype",False,True,False,False,True
297,"I am a 69-year-old man who sought emergency care due to pain in my right flank that radiated to my groin. Along with the pain, I experienced partial constipation, which improved after using a laxative. My medical history includes well-controlled hypertension, for which I take hydrochlorothiazide, and I also take a daily multivitamin. I do not have any history of substance use.

During the physical examination, the medical team noted that my temperature was 99.1°F, my blood pressure was 130/90 mmHg, my heart rate was 90 beats per minute, and my respiratory rate was 14 breaths per minute. They also found tenderness in my right costovertebral angle. 

After some tests, it was revealed that I had elevated serum calcium levels and low phosphate levels. An abdominal CT scan showed a calcium-based mass in my right ureter. The medical staff is now considering the most likely underlying pathologic process responsible for my symptoms and the findings from the examination and imaging.",A. Functional adenoma B. Metastatic bone disease C. Hypervitaminosis D. Granulomatous disease E. Thiazide-induced hypercalcemia F. Tertiary hyperparathyroidism G. Adverse drug reaction H. Parathyroid hyperplasia I. PTH-related peptide J. Familial hypocalciuric hypercalcemia,A,Functional adenoma,neutral,"The symptoms and findings you described, including flank pain radiating to the groin, elevated serum calcium levels, low phosphate levels, and the presence of a calcium-based mass in the right ureter, suggest the presence of a kidney stone, likely a calcium stone. The elevated calcium levels could indicate primary hyperparathyroidism, which is a common cause of hypercalcemia and can lead to the formation of calcium-based stones. The low phosphate levels may also support this diagnosis, as hyperparathyroidism often results in renal phosphate wasting. Therefore, the most likely underlying pathologic process is primary hyperparathyroidism leading to hypercalcemia and subsequent nephrolithiasis (kidney stones).",Functional adenoma,False,False,False,False,True
298,"I am a 42-year-old male who recently went to the emergency department due to a cough that had persisted for a week. This cough was accompanied by blood-tinged sputum and difficulty breathing. During this time, I also experienced fever, chills, and joint pain. 

Upon arrival, the medical team took my vital signs, which indicated a temperature of 102°F. My blood pressure was measured at 159/98 mmHg, and my pulse was 80 beats per minute with a respiratory rate of 14 breaths per minute. My oxygen saturation levels were stable at 98% on room air.

The doctors conducted various tests, including blood work and a urinalysis. The results showed a hemoglobin level of 12 g/dL, and my hematocrit was at 36%. My white blood cell count was within normal limits, though my platelet count was slightly low at 107,000/mm³. The chemistry panel indicated elevated levels of BUN and creatinine, suggesting potential kidney issues. 

A CT scan of my chest and blood cultures were performed, but both returned negative results. I was informed that further diagnostic steps were necessary to determine the appropriate course of treatment.",A. Prednisone B. Echocardiography to evaluate for endocarditis C. Pulmonary function tests D. Anti-neutrophil cytoplasmic antibody (ANCA) levels E. Azithromycin F. Sputum acid-fast bacilli (AFB) testing G. Bronchoscopy with biopsy H. Renal biopsy I. Empiric treatment with ceftriaxone and azithromycin J. Type 4 collagen antibody levels,J,Type 4 collagen antibody levels,neutral,"Based on your symptoms and test results, it appears you may be experiencing a serious respiratory condition, possibly pneumonia or a pulmonary embolism, given the cough with blood-tinged sputum, fever, and difficulty breathing. The elevated BUN and creatinine levels suggest potential kidney involvement, which could be related to dehydration or a systemic infection. The low platelet count may indicate a possible underlying hematological issue or a reaction to infection.

Since the CT scan and blood cultures were negative, further diagnostic steps could include a bronchoscopy to obtain samples from the lungs, or additional imaging studies to rule out other conditions such as malignancy or autoimmune disorders. It's crucial to follow up with your healthcare provider for a comprehensive evaluation and tailored treatment plan.",Type 4 collagen antibody levels,False,False,False,False,True
299,"I am a 62-year-old male who was admitted to the hospital after experiencing acute pain in my left groin. This pain followed a slip I took on ice. Upon examination, radiography confirmed that I had a left femoral neck fracture. 

In my medical history, I have been managing type 1 diabetes since I was 14 years old. I also developed vitiligo in my thirties and was diagnosed with primary hypothyroidism at age 45. During the physical examination at the hospital, my heart rate was recorded at 88 beats per minute, and my blood pressure was 128/76 mm Hg. I presented with external rotation of my left leg.

Additionally, a dual-energy x-ray absorptiometry scan indicated T scores of -2.8 for my right femoral neck and -2.5 for L1–L4, suggesting concerns related to bone density. These findings have raised questions about the underlying conditions contributing to my fracture and bone health. I am now in the process of further evaluation to determine the best course of action for my recovery and treatment.",A. Autoimmune polyglandular syndrome B. Primary hyperparathyroidism C. Thyroid hormone-induced bone loss D. Celiac disease E. Idiopathic male osteoporosis F. Hypogonadal osteoporosis G. Type 1 diabetes-induced osteoporosis H. Vitamin D deficiency osteomalacia I. Age-related osteoporosis J. Secondary hyperparathyroidism,D,Celiac disease,neutral,"Given your history of type 1 diabetes, vitiligo, and primary hypothyroidism, along with the dual-energy x-ray absorptiometry (DEXA) results indicating osteoporosis, several factors may have contributed to your left femoral neck fracture. 

Type 1 diabetes can lead to complications such as reduced bone density and increased fracture risk due to factors like neuropathy and impaired bone metabolism. The presence of osteoporosis, as indicated by your T scores, suggests that your bones are weaker than normal, which is a significant risk factor for fractures, especially in older adults.

Your external rotation of the left leg and acute pain are consistent with a femoral neck fracture, which is common in individuals with compromised bone health. 

For your recovery and treatment,",Celiac disease,False,False,False,False,True
300,"I am a 58-year-old woman who visited the clinic with intermittent non-bloody diarrhea that has persisted for two months. For the past six months, I have been following a raw food diet to lose weight. Additionally, I have a history of anxiety that I have been managing with fluvoxamine, as well as osteopenia. 

In terms of family history, my mother has lactose intolerance and was recently diagnosed with osteoporosis. I do not use any substances and returned from a trip to Uganda three months ago. During my visit to the clinic, my vital signs were stable, with a temperature of 99°F, blood pressure of 130/78 mmHg, pulse at 70 beats per minute, and respirations at 14 breaths per minute, with oxygen saturation at 98% on room air. 

A physical examination revealed a newly discovered systolic ejection murmur that was most prominent at the left second intercostal space. I am currently trying to understand what complication might be most commonly associated with my presentation.",A. Decreased urinary 5-HIAA B. Decreased levels of chromogranin A C. Niacin deficiency D. Positive hydrogen breath test E. Elevated serum serotonin levels F. Folate deficiency G. Vitamin D deficiency H. Vitamin B12 malabsorption I. Thiamine deficiency J. Iron deficiency anemia,C,Niacin deficiency,neutral,"Given your symptoms of intermittent non-bloody diarrhea, recent travel to Uganda, and the new systolic ejection murmur, a likely complication to consider is **infectious enteritis** due to a parasitic infection, such as from Giardia lamblia or other pathogens endemic to the region. This could explain the diarrhea, and the murmur may suggest a possible volume overload or other cardiac changes due to dehydration or electrolyte imbalances. Additionally, your raw food diet could contribute to nutritional deficiencies, which may also play a role in your symptoms. It's important to follow up with appropriate testing and evaluation.",Niacin deficiency,False,False,False,False,True
301,"After my surgery for lower extremity long bone and periarticular fractures, I sought information regarding the expected time frame to regain normal automobile braking ability. I learned that several factors could influence this timeline, including weight bearing status and the extent of recovery. 

One option suggested that it might take 6 weeks postoperatively to achieve this ability, independent of whether I was bearing weight. Another possibility indicated that it could take around 3 months, again regardless of weight bearing. I also found that some sources stated that regaining full range of motion in the ankle and knee was crucial before I could expect to drive normally.

Other timelines mentioned included 5 weeks after I began weight bearing, 8 weeks from the date of injury, and varying weeks post-initiation of weight bearing, such as 6 weeks or even 12 weeks. There was also a suggestion of 4 weeks after starting weight bearing or 4 weeks postoperatively, regardless of weight bearing. 

This range of expectations highlighted the complexity of recovery, and I was advised to consult my healthcare provider for personalized guidance based on my progress.",A. 6 weeks postoperatively regardless of weight bearing B. 3 months postoperatively regardless of weight bearing C. Once full range of motion of the ankle and knee exist D. 5 weeks after initiation of weight bearing E. 8 weeks from the date of injury F. 6 weeks after initiation of weight bearing G. 8 weeks after initiation of weight bearing H. 4 weeks after initiation of weight bearing I. 4 weeks postoperatively regardless of weight bearing J. 12 weeks after initiation of weight bearing,F,6 weeks after initiation of weight bearing,neutral,"The timeline to regain normal automobile braking ability after surgery for lower extremity fractures can vary significantly based on individual recovery, weight-bearing status, and range of motion. Generally, it may take anywhere from 4 weeks to 3 months post-surgery, with many factors influencing this timeframe. It's essential to consult your healthcare provider for personalized advice based on your specific situation and progress.",6 weeks after initiation of weight bearing,False,True,False,False,True
