index,question,options,solution_idx,solution_text,question_tone,default,alternative,default_correct,correct_a,correct_b,correct_c,correct_d
202,"I am a 78-year-old woman who recently underwent a shoulder hemiarthroplasty. This surgery took place two days after I sustained a 4-part proximal humerus fracture on my dominant side. During the procedure, the surgical team faced challenges in reducing the lesser tuberosity, which ended up being positioned too close to the anatomically placed greater tuberosity. 

In reflecting on the surgery and potential outcomes, I understand that this malposition could lead to specific post-operative complications. I have been informed that complications related to the lesser tuberosity's placement might affect my shoulder's function. The medical team explained various risks, including issues with my biceps tendon, rotator interval, supraspinatus, and subscapularis, as well as potential deficits in rotation and abduction. 

As I continue my recovery, I remain aware of these possible complications and will keep them in mind during my rehabilitation process. I am committed to following my post-operative care plan to help mitigate any issues and improve my shoulder function.",A. biceps tendon dysfunction B. rotator interval dysfunction C. supraspinatus dysfunction D. external rotation deficit E. internal rotation deficit F. subscapularis impingement G. abduction weakness H. forward flexion limitation I. forward elevation weakness J. glenohumeral instability,D,external rotation deficit,neutral,"It's great to hear that you're committed to your recovery after your shoulder hemiarthroplasty. Given the challenges with the lesser tuberosity's positioning, it's important to monitor for potential complications such as biceps tendon issues, rotator cuff dysfunction, and limitations in shoulder movement. Adhering to your rehabilitation plan, including physical therapy and any prescribed exercises, will be crucial in optimizing your shoulder function and minimizing complications. Regular follow-ups with your healthcare team will also help address any concerns as you progress in your recovery. Stay positive and focused on your rehabilitation goals!",external rotation deficit,False,True,True,False,True
203,"I am an 8-year-old male with cystic fibrosis, diagnosed shortly after birth through neonatal screening. I experienced meconium ileus at birth and have had a history of multiple respiratory infections that required hospitalization. Recently, I went to the emergency department due to acute respiratory symptoms that had worsened over the past two days. 

When I arrived, I had a fever of 39.6°C, and I was breathing rapidly, with a rate of 44 breaths per minute. My heart was racing at 122 beats per minute, and I was producing yellow sputum. During the physical examination, the doctor noted that I was having labored breathing and had subcostal retractions. They also detected decreased breath sounds and dullness when tapping on my right upper lung.

My oxygen saturation was measured at 91% while I was breathing room air. I am currently taking medications, including albuterol, pancreatic enzymes, and vitamins A and D3. The doctor mentioned that a chest x-ray showed consolidation in my right upper lobe, along with increased translucency and tram-track opacities in the upper lung fields. They are considering which pathogen might be responsible for my current condition.",A. Pseudomonas aeruginosa B. Mycoplasma pneumoniae C. Haemophilus influenzae D. Escherichia coli E. Aspergillus fumigatus F. Klebsiella pneumoniae G. Moraxella catarrhalis H. Streptococcus pneumoniae I. Burkholderia cepacia J. Staphylococcus aureus,J,Staphylococcus aureus,neutral,"Given your symptoms and history, the most likely pathogen responsible for your acute respiratory symptoms and lung consolidation is **Pseudomonas aeruginosa**. This bacterium is commonly associated with respiratory infections in individuals with cystic fibrosis, especially in the context of worsening respiratory symptoms, fever, and the presence of yellow sputum. The chest x-ray findings of consolidation and tram-track opacities further support this diagnosis, as they are indicative of bronchiectasis and infection.",Staphylococcus aureus,False,False,False,False,True
204,"I was brought into the office by my mother because she noticed that my urine appeared red yesterday. I wasn’t feeling any discomfort, burning, or urgency when urinating, nor did I have a fever or back pain. Overall, I was active and playful, and my vaccinations were up to date. I hadn’t experienced any hospitalizations or surgeries, and my growth and development seemed to be on track.

During the examination, I played and interacted normally, and the doctor noted that I appeared well and not in distress. They performed a genital examination, which was standard, but an abdominal study revealed a mass in my right flank. The mass did not seem tender and felt smooth when the doctor palpated it.

While my condition had not caused me any noticeable symptoms, the discovery of the mass raised concerns. The medical team discussed potential implications, considering various factors associated with the mass. It was important to monitor my situation closely and determine the nature of the mass through further evaluation.","A. This child is having neuroblastoma, a tumor related to supra-renal  glands B. 90% of the patients have a favorable histologic finding in biopsy C. The most common site of metastasis for this tumor is the bone marrow D. This tumor is associated with aniridia and genitourinary abnormalities E. The mass is most likely derived from neural crest cells F. The tumor is often bilateral, especially in familial cases G. The histology of the mass should be rosettes with central  fibrillar material. H. Due to being mostly asymptomatic, most patients have a distant disease at the moment of diagnosis I. The most common presentation of this tumor is hematuria J. This tumor is associated with elevated catecholamines in the urine",B,90% of the patients have a favorable histologic finding in biopsy,neutral,"The presence of a red urine color, along with the discovery of a non-tender, smooth mass in the right flank, raises concerns for potential underlying conditions, such as a renal or urinary tract issue. Given that you are asymptomatic otherwise, the medical team will likely recommend imaging studies, such as an ultrasound or CT scan, to further evaluate the mass and determine its nature. Close monitoring and follow-up will be essential to ensure appropriate management and to rule out any serious conditions.",90% of the patients have a favorable histologic finding in biopsy,False,True,False,False,True
205,"I am a 16-year-old girl who visited the clinic for a follow-up appointment two weeks after being treated for my first urinary tract infection. At this visit, I was asymptomatic. 

During the examination, the healthcare provider noted my height and weight, which placed me in the 95th and 25th percentiles, respectively. My vital signs were taken, revealing a temperature of 37.5°C, a heart rate of 90 beats per minute, a respiratory rate of 18 breaths per minute, and a blood pressure reading of 130/80 mm Hg. The cardiac examination was reported as normal.

I recalled that during two previous visits, my blood pressure readings were 136/84 mm Hg and 130/81 mm Hg. I had also monitored my blood pressure at home over the past month, obtaining similar readings. My medical history was otherwise unremarkable, and I am not currently taking any medications. In discussing my family history, I mentioned that my father was recently diagnosed with hypertension, and my maternal grandmother had an acute myocardial infarction last year at age 72.

The urinalysis performed was normal. Given my blood pressure readings and family history, I was informed that further evaluation might be warranted to determine the appropriate classification for my blood pressure.",A. Borderline BP requiring continued monitoring B. Isolated systolic hypertension C. Stage 1 hypertension D. Secondary hypertension due to renal causes E. Stage 2 hypertension F. Normal BP for age and height percentile G. Normal BP with white coat syndrome H. Transient BP elevation due to recent UTI I. Stress-induced BP elevation J. Elevated BP (previously described as “prehypertension”),C,Stage 1 hypertension,neutral,"Based on your blood pressure readings, family history of hypertension, and your age, it is advisable to conduct further evaluation to assess your blood pressure classification. Your readings of 136/84 mm Hg and 130/81 mm Hg suggest that you may fall into the category of elevated blood pressure or stage 1 hypertension, especially considering your father's recent diagnosis. Regular monitoring and possibly lifestyle modifications or further assessment by a healthcare provider would be prudent to manage your blood pressure effectively.",Stage 1 hypertension,False,True,False,False,True
206,"I am a 26-year-old medical intern, and recently, while placing a central venous catheter in a critically ill patient with known HIV/AIDS who was not on antiretrovirals, I experienced a mishap. My hand slipped, and I sustained a needlestick injury from the exposed needle of the catheter. 

At the time of the incident, I had no other recent exposures to HIV. I had received the hepatitis B vaccination during medical school, but I did not undergo testing to confirm whether I had developed immunity. I was born in the United States and do not have any other risk factors for hepatitis B infection.

In light of the needlestick injury and my medical history, I understood the importance of undergoing appropriate diagnostic tests immediately. Given the circumstances, I needed to determine my HIV status, assess my hepatitis B immunity, and check for hepatitis C exposure. I considered several combinations of diagnostic tests to ensure a comprehensive evaluation.","A. HIV antibody/antigen combo test, hepatitis B core antibody, and hepatitis C RNA B. HIV viral load, hepatitis B core antibody, and hepatitis C antibody C. HIV antigen/antibody combo test, complete hepatitis B panel, and hepatitis C viral load D. HIV proviral DNA, hepatitis B DNA, and hepatitis C antibody E. HIV Western blot, hepatitis B e antigen, and hepatitis C genotype F. HIV p24 antigen, hepatitis B surface antibody, and hepatitis C core antibody G. HIV antibody, HIV viral load, and hepatitis B surface antibody H. HIV RNA PCR, hepatitis B surface antigen, and hepatitis C antibody I. HIV antibody, HIV viral load, hepatitis B surface antibody, and hepatitis C antibody J. HIV antibody, hepatitis B surface antibody, and hepatitis C antibody",J,"HIV antibody, hepatitis B surface antibody, and hepatitis C antibody",neutral,"In light of your needlestick injury, it is crucial to take the following steps for a comprehensive evaluation:

1. **HIV Testing**: Get an HIV test immediately to determine your status. Follow up with additional testing at 6 weeks, 3 months, and 6 months post-exposure.

2. **Hepatitis B Testing**: Since you received the hepatitis B vaccination but did not confirm immunity, you should undergo a hepatitis B surface antibody (anti-HBs) test. If you are not immune (anti-HBs negative), you may need a booster dose of the vaccine.

3. **Hepatitis C Testing**: Get tested for hepatitis C virus (HCV) antibodies. If positive, further testing for HCV","HIV Western blot, hepatitis B e antigen, and hepatitis C genotype",True,True,False,True,True
207,"I am a 78-year-old man with a medical history that includes diabetes mellitus and hypertension, for which I take metformin and lisinopril. One evening, while eating dinner, I suddenly experienced slurred speech and noticeable asymmetry in my face. This episode occurred approximately 30 minutes before I was transported to the emergency department.

Upon arrival, my vital signs were assessed. My temperature was 99.1°F, blood pressure measured 160/85 mmHg, my heart rate was 80 beats per minute, my respiratory rate was 14 breaths per minute, and my oxygen saturation was 98% on room air. A point-of-care glucose test showed my blood sugar level at 120 mg/dL.

During the physical examination, I was oriented only to my person. The doctor noted a left-sided facial droop and significant weakness in my upper extremities, with my left side rated at 1/5 and my right at 5/5. The medical team began discussing the immediate next steps for my management, considering the symptoms I presented.",A. CT head without contrast B. MRI brain with contrast C. Echocardiography D. Administration of aspirin E. Observation and repeat neurological exam in 1 hour F. Aspirin G. Lumbar puncture H. Carotid Doppler ultrasound I. CT head with contrast J. CT angiogram head and neck,A,CT head without contrast,neutral,"Based on your symptoms and examination findings, it appears you may have experienced a stroke, likely a right-sided ischemic stroke given the left-sided facial droop and weakness. The immediate next steps in your management would include obtaining a CT scan of the head to rule out hemorrhagic stroke, followed by consideration for thrombolytic therapy if appropriate, depending on the time since symptom onset and other clinical criteria. Additionally, monitoring and managing your blood pressure and other vital signs will be crucial.",CT head without contrast,False,True,False,True,True
208,"I brought my 6-week-old infant in for a routine check-up. I reported to the doctor that my baby has been feeding and growing well, but there are times when he experiences episodes of crying that are difficult to soothe. During these episodes, he tends to draw up his legs and strain. I noticed that these crying spells occur more frequently in the evenings and begin and end without any clear cause. 

I mentioned that my baby has a bowel movement every two days and produces about 5-6 wet diapers daily. He breastfeeds every 2-3 hours. During the examination, the doctor noted that he appeared healthy, was smiling and interacting normally, and was growing and developing appropriately. I confirmed that his vaccinations are up to date, and the doctor conducted a full head-to-toe examination, which was unremarkable.

After discussing my observations, I was curious about the possible diagnosis for his crying episodes. The doctor explained various possibilities, considering factors such as dietary influences, behavioral aspects, and potential associations with developmental milestones. I left the appointment feeling reassured about my baby’s health, yet I remain attentive to his behavior and any changes as he continues to grow.","A. Typically resolves when solid foods are introduced at 4 months B. Behavioral syndrome with continuous crying without most of the times a factor can be identified C. Associated with increased risk of asthma and allergies in later childhood D. Primarily caused by lactose intolerance and requires dietary modification E. More prevalent in formula-fed infants compared to breastfed infants F. More common in firstborn children due to parental inexperience G. Strongly correlated with delayed developmental milestones in early childhood H. Associated with maternal anxiety and depression during pregnancy, requiring psychological intervention I. Colic is generally diagnosed as a diagnosis of exclusion after proper workup with blood tests and imaging examination J. More common in children of mothers that have migraine or children that will develop migraine in later childhood",J,More common in children of mothers that have migraine or children that will develop migraine in later childhood,neutral,"Based on your description, it sounds like your infant may be experiencing colic. Colic is characterized by excessive crying in an otherwise healthy baby, often occurring in the evening, and can involve signs like drawing up legs and straining. The fact that your baby is feeding well, growing appropriately, and has a normal examination supports this possibility. It's important to monitor his behavior and consult your pediatrician if you have further concerns or if the crying worsens.",More common in children of mothers that have migraine or children that will develop migraine in later childhood,False,False,False,False,False
209,"I am a 56-year-old male with a complex medical history that includes alcohol use disorder, hepatitis C, and a post-liver transplant due to hepatocellular carcinoma. I was transported by ambulance due to an altered mental status, persistent nausea, vomiting, and high fevers. Upon arrival, my vital signs were concerning; I had a temperature of 104.9°F, hypotension with a reading of 60/35 mmHg, tachycardia at 130 beats per minute, and a respiratory rate of 18 per minute. I felt distressed and was diaphoretic, only responding intermittently to those around me.

In the emergency department, medical staff initiated treatment with vasopressors and broad-spectrum antibiotics. They also took cultures of my blood and other samples. Given my history of two septic shock admissions in the past six months, it was crucial for the medical team to gather comprehensive information upon my admission. I was subsequently admitted to the intensive care unit for further monitoring and treatment.",A. Advance directive documentation B. Immunosuppressive medication history C. Recent imaging studies D. Cultures of indwelling devices E. Next of kin contact information F. Baseline cognitive assessment G. Previous discharge summaries of prior hospital admissions H. Code status I. Blood ammonia levels J. Liver function tests,H,Code status,neutral,"Given your complex medical history and current presentation, it appears you are experiencing septic shock, likely due to an infection, which is common in post-liver transplant patients. The high fever, hypotension, tachycardia, and altered mental status indicate a severe systemic response. The initiation of vasopressors and broad-spectrum antibiotics is appropriate to stabilize your condition and address potential sources of infection. Continuous monitoring in the ICU is essential for managing your vital signs and adjusting treatment as needed. Further diagnostic tests, including imaging and cultures, will help identify the infection source and guide targeted therapy.",Code status,False,False,False,False,True
210,"I am a 17-year-old male who collapsed at the finish line of a cross-country race. The conditions during the race were quite intense, with a temperature of 38.3°C and 85% humidity. Before the race, I was sweating, and as I approached the finish line, I began to stagger. 

After my collapse, I was taken to the emergency department for evaluation. When the medical staff assessed me, I was confused and lethargic. They noted that my skin was dry, but my extremities felt warm to the touch. My rectal temperature was recorded at 40.0°C, indicating a significant fever. 

The medical team quickly considered the best immediate intervention for my condition, given the symptoms and the environmental factors at play during the race. I was in a state that required prompt and effective treatment to address my elevated body temperature and overall distress.","A. Intravenously administer cold normal saline B. Completely immerse the patient to the neck in cold water (10–20°C) C. Administer antipyretics to lower the temperature D. Use ice packs on the groin, axillae, and neck to reduce core temperature E. Perform gastric lavage with cold saline to reduce temperature F. Perform evaporative cooling with fans and misting G. Administer intravenous fluids without active cooling measures H. Place the patient in an air-conditioned room and monitor closely I. Apply a cooling blanket J. Completely immerse the patient to the neck in ice water (2–3°C)",J,Completely immerse the patient to the neck in ice water (2–3°C),neutral,"Based on your symptoms and the environmental conditions, it appears you may be experiencing heat exhaustion or heat stroke. The high temperature and humidity, combined with your confusion, lethargy, and elevated body temperature, indicate a serious heat-related illness.

The best immediate intervention for your condition would be rapid cooling. This can be achieved through methods such as:

1. **Removing excess clothing** to help with heat dissipation.
2. **Applying cool water** to your skin or using ice packs on key areas (like the neck, armpits, and groin).
3. **Using fans** to increase air circulation around you.
4. **Hydration** with cool fluids, if you are able to drink.

These measures aim to lower your body",Completely immerse the patient to the neck in ice water (2–3°C),False,True,False,False,True
211,"I am a 48-year-old male who was diagnosed with nonischemic cardiomyopathy three months ago during a hospitalization. At that time, my ejection fraction was noted to be 30%. Since my diagnosis, I have been following a treatment plan that includes carvedilol, spironolactone, dapagliflozin, sacubitril-valsartan, and torsemide. 

During my recent clinic visit, I reported that I am currently asymptomatic and can walk for an hour without experiencing dyspnea. I also denied any issues with orthopnea or edema. My physical examination showed a BMI of 36, blood pressure of 112/68 mm Hg, heart rate of 64 beats per minute, and an O2 saturation level of 99% on room air. The examination revealed a neck circumference of 38.1 cm and a jugular venous pressure of 5 cm H2O. My lungs were clear, and my heart sounds were regular without murmurs. My abdomen was soft, and I had warm extremities with trace pedal edema.

Despite feeling well, I have elevated brain natriuretic peptide levels, which raises questions about the potential causes behind this. Some factors that could be contributing include subclinical volume overload, elevated pulmonary pressures, or possibly my underlying condition of persistent left ventricular dysfunction.",A. Subclinical volume overload B. Elevated pulmonary pressures C. Obstructive sleep apnea D. Increased adipose tissue interfering with BNP clearance E. Inadequate dose of diuretic therapy F. Obesity G. Chronic kidney disease H. Prolonged use of beta-blockers I. Persistent left ventricular dysfunction J. Sacubitril-valsartan use,J,Sacubitril-valsartan use,neutral,"Given your current clinical status and treatment regimen, the elevated brain natriuretic peptide (BNP) levels could be attributed to several factors:

1. **Persistent Left Ventricular Dysfunction**: Despite being asymptomatic and having a good exercise tolerance, your ejection fraction remains low at 30%. This ongoing dysfunction can lead to elevated BNP levels as the heart struggles to manage volume and pressure.

2. **Subclinical Volume Overload**: Even with trace pedal edema and a normal jugular venous pressure, there may still be subtle fluid retention that isn't overtly symptomatic. This can contribute to elevated BNP levels.

3. **Elevated Pulmonary Pressures**: Nonischemic cardiomyopathy can lead to diastolic dysfunction and",Sacubitril-valsartan use,False,False,False,False,True
212,"I am a 26-year-old PhD student, and I have been experiencing a rash on my right upper extremity for the past week. The rash initially appeared as clustered ""pimples,"" which followed two days of intense burning pain in the same area. Although the pain has decreased, the rash remains, even after I applied over-the-counter zinc ointment.

I spend extensive hours working in a laboratory and have multiple sexual partners. The only medication I take is oral contraception. During my recent examination, I had a temperature of 37.8°C (100.0°F), a pulse of 80 beats per minute, and a blood pressure reading of 117/72 mm Hg. The examination revealed multiple crusted lesions along the medial aspect of my upper extremity, extending from the axillary fossa down to my forearm. 

Despite these symptoms, my neurological and other physical examinations were unremarkable. I am now seeking guidance on the most appropriate next steps in managing my condition.",A. STI screening panel B. HIV screening C. Acyclovir therapy D. Culture of lesions E. Serologic testing for syphilis F. Topical corticosteroid treatment G. Reassurance and follow-up H. Valacyclovir therapy I. Skin biopsy J. Empiric antibiotic therapy,B,HIV screening,neutral,"Based on your symptoms and examination findings, it is possible that you are experiencing a herpes zoster (shingles) outbreak, especially given the clustered lesions and the burning pain you described. The rash's location along the upper extremity and the presence of crusted lesions further support this possibility.

The next appropriate steps in managing your condition would include:

1. **Antiviral Therapy**: Initiate treatment with antiviral medications such as acyclovir, valacyclovir, or famciclovir as soon as possible to reduce the severity and duration of the outbreak.

2. **Pain Management**: Consider analgesics for pain relief, which may include NSAIDs or, if necessary, stronger pain medications.

3. **Follow-Up**:",HIV screening,False,True,False,False,False
