index,question,options,solution_idx,solution_text,question_tone,default,alternative,default_correct,correct_a,correct_b,correct_c,correct_d
101,"I am an 80-year-old woman living alone, and I recently visited urgent care due to worsening fatigue I had been experiencing over the past two days. I found myself needing more daytime naps and felt persistently tired, even after what I thought was restful sleep at night. Typically, I can carry two bags of groceries from my car to my kitchen without much trouble, but yesterday I struggled to carry even one bag and needed to rest after each trip.

I did not have any chest pain, shortness of breath, fever, chills, or any issues with urination or respiratory symptoms like cough or congestion. I did note that my teenage grandson had visited last week and had a runny nose and cough, but I did not think much of it at the time.

During my examination, the healthcare provider noted that I appeared fatigued but was not in acute distress. They performed several tests, including vital signs and a cardiopulmonary examination, all of which came back normal. I also learned that I am up to date on my vaccinations for Covid-19, influenza, and pneumonia.

Now, I am left wondering what the most appropriate next step in managing my condition should be.",A. Refer to physical therapy B. Initiate a trial of corticosteroids for possible inflammatory condition C. Refer for a sleep study to evaluate for obstructive sleep apnea D. Order a thyroid-stimulating hormone level E. Prescribe empiric antibiotics for possible bacterial infection F. Check serum ferritin and iron studies for possible anemia G. Order a brain MRI to rule out a central nervous system etiology H. Order a chest CT to rule out occult pulmonary pathology I. Order a viral respiratory panel including SARS-CoV-2 J. Perform an echocardiogram to evaluate for heart failure,I,Order a viral respiratory panel including SARS-CoV-2,neutral,"Given your symptoms of worsening fatigue, increased need for naps, and difficulty with daily activities, it's important to follow up with your primary care physician. They can conduct a more comprehensive evaluation, including blood tests to check for anemia, thyroid function, or other underlying conditions that could contribute to your fatigue. Additionally, they may assess your overall health and consider any recent changes in your lifestyle or medications. It's also advisable to monitor your symptoms closely and seek immediate care if you experience any new or worsening symptoms.",Order a viral respiratory panel including SARS-CoV-2,False,True,False,False,True
102,"I am a 73-year-old male who has been experiencing worsening pain in both of my lower extremities for the past eight months. This pain typically begins after walking one to two blocks and radiates down to my buttocks, often accompanied by cramping and tingling sensations. I have noticed that the pain worsens when I walk downhill, but it eases when I sit down or lean forward.

My medical history includes hypertension, hyperlipidemia, type 2 diabetes mellitus, and a myocardial infarction at age 55. I also underwent an abdominal aortic aneurysm repair at age 60. I have a long history of smoking, having smoked one pack of cigarettes daily for 30 years, but I do not consume alcohol or use illicit drugs. 

Currently, I take several medications, including sitagliptin, metformin, atorvastatin, metoprolol succinate, amlodipine, and hydrochlorothiazide. During my recent examination, my vital signs showed a temperature of 37.5°C, a pulse of 82 beats per minute, respirations at 17 per minute, and blood pressure recorded at 150/87 mm Hg. The physical examination indicated full muscle strength, but I had reduced sensation in my feet and toes bilaterally. The straight leg raise test came back negative, and an X-ray of my spine revealed degenerative changes. 

I am now considering the most appropriate next diagnostic step to address my symptoms.",A. CT angiography of lower extremities B. Bone scan C. Nerve conduction studies D. EMG of lower extremities E. Measurement of the ankle brachial index F. CT scan of the spine G. Measurement of HLA-B27 antigen H. Doppler ultrasound of lower extremities I. MRI scan of the spine J. Plain radiographs of the lumbar spine with flexion and extension views,I,MRI scan of the spine,neutral,"Given your symptoms of bilateral lower extremity pain, cramping, and tingling that worsen with walking and improve with sitting, along with your history of vascular issues and degenerative changes in the spine, the most appropriate next diagnostic step would be to obtain an MRI of the lumbar spine. This imaging can help assess for potential spinal stenosis or other structural issues that may be contributing to your symptoms.",Measurement of HLA-B27 antigen,True,True,False,True,True
103,"I am a 24-year-old male who arrived at the emergency department after my car was hit from behind while it was stationary. The other vehicle was traveling at a low speed of 11 miles per hour. Following the collision, I experienced intense back pain but did not report any other symptoms. 

I have a history of back pain for which I have been undergoing physical therapy. My back pain tends to be most severe in the mornings, improves with physical activity, and worsens when I am inactive. As a university student, I have been facing academic difficulties, which adds to my stress.

Upon evaluation in the emergency department, my vital signs were stable, and I was found to have spinal tenderness and a limited range of motion during the physical examination, which was primarily restricted due to pain. I was seeking documentation to excuse me from my final examinations and work duties, as the pain was affecting my ability to function normally.",A. Herniated nucleus pulposus B. Psychogenic pain disorder C. Acute disc herniation D. Musculoskeletal strain E. Spondylolisthesis F. Factitious disorder G. Conversion disorder H. Malingering I. Spinal cord contusion J. Vertebral fracture,J,Vertebral fracture,neutral,"Based on your description, it seems you are experiencing an exacerbation of your chronic back pain following the low-speed collision. Given your history of back pain, the spinal tenderness, and limited range of motion, it is important to manage your pain effectively and consider a treatment plan that may include rest, physical therapy, and possibly pain management strategies.

For documentation to excuse you from examinations and work duties, it would be advisable to have a healthcare provider formally assess your condition. They can provide a note that outlines your current symptoms, the impact on your daily functioning, and recommendations for rest or modified activities. This documentation will help support your request for accommodations during this time.",Vertebral fracture,False,False,False,False,False
104,"I am a 44-year-old female and have been experiencing progressive scleral icterus and itching for the past three months. I do not have any significant medical history and I am not currently taking any medications. When I visited the doctor, my vital signs were normal, but during the physical examination, the doctor noted that my sclerae were icteric and there were linear scratch marks on my trunk and extremities. Other findings from the examination were unremarkable. 

Despite the physical examination, the doctor decided to conduct further tests. The results showed that my hemoglobin, leukocyte count, and liver enzymes were within certain ranges, and my total bilirubin was elevated. An MRCP was performed, which demonstrated diffuse beading of both intrahepatic and extrahepatic bile ducts with multifocal involvement. 

Given these findings, there was a discussion about the next appropriate diagnostic test. The options included various procedures such as colonoscopy, nuclear medicine hepatobiliary scan, and others, but the best course of action was still under consideration.",A. Colonoscopy B. Nuclear medicine hepatobiliary scan C. Percutaneous transhepatic cholangiography (PTC) D. Upper endoscopy (EGD) E. Liver biopsy F. No further testing is indicated G. Endoscopic retrograde cholangiopancreatography (ERCP) H. Antimitochondrial antibody testing I. Serum IgG4 level testing J. CT scan of the abdomen with contrast,A,Colonoscopy,neutral,"Based on the symptoms and test results you've described, particularly the progressive scleral icterus, itching, elevated total bilirubin, and the MRCP findings of diffuse beading of the bile ducts, the clinical picture is suggestive of primary sclerosing cholangitis (PSC). 

In this context, the next appropriate diagnostic test would be a colonoscopy with biopsy to evaluate for associated inflammatory bowel disease (IBD), particularly ulcerative colitis, which is commonly associated with PSC. This would help confirm the diagnosis and guide further management.",Percutaneous transhepatic cholangiography (PTC),True,False,False,False,False
105,"I am a 77-year-old man who recently visited the clinic with my daughter for a routine follow-up appointment. I did not have any complaints during the visit, but my daughter mentioned that I had been feeling more fatigued during exertion and had been sleeping more often. Just last week, I completed a 10-day course of ciprofloxacin for a prostate infection, and my urinary symptoms have resolved completely.

My medical history includes hypertension, type 2 diabetes, paroxysmal atrial fibrillation, and moderate vascular dementia. I take several medications daily, including donepezil, verapamil, lisinopril, sotalol, and apixaban.

During the physical examination, my temperature was measured at 37.2°C, my blood pressure was 130/60 mm Hg, and my heart rate was noted to be 45 beats per minute. My respiratory rate was recorded at 12 breaths per minute, and my lungs were clear upon examination. The doctor observed a regular heart rhythm with no murmurs, but I did have mild pitting edema in both lower legs.

After our discussion, the doctor considered the next steps for my care, weighing options based on my current health status and symptoms.",A. Reduce the sotalol dose by 50% B. Obtain an electrocardiogram C. Check serum digoxin level D. Initiate temporary pacing E. Order an echocardiogram F. Schedule Holter monitoring G. Obtain cardiac biomarkers H. Check serum electrolytes I. Stop the verapamil with close follow-up J. Obtain thyroid function tests,B,Obtain an electrocardiogram,neutral,"Given your symptoms of increased fatigue during exertion, bradycardia (heart rate of 45 bpm), and mild pitting edema, it’s important to consider the potential impact of your medications, particularly sotalol, which can cause bradycardia. The combination of your heart rate and fatigue may indicate that your heart is not pumping effectively, possibly due to the effects of your medications or underlying cardiac issues.

The doctor may consider adjusting your sotalol dosage or switching to a different antiarrhythmic medication. Additionally, monitoring your renal function and electrolytes is crucial, especially since you have diabetes and are on multiple medications. The mild edema could also suggest fluid retention, which may need further evaluation.

Overall, the next steps would",Obtain an electrocardiogram,False,True,True,False,True
106,"I am a 47-year-old man who recently sought medical attention due to persistent fatigue and a noticeable decrease in libido. Over the past year, I've observed a decline in my sexual interest, experiencing infrequent morning erections and only mild erections during masturbation. Occasionally, I wake up with headaches in the morning.

I have two healthy children, aged 15 and 17, and I have been divorced. My puberty was normal, and I do not have any history of testicular trauma or mumps infection. I have not noticed any loss of axillary or pubic hair, and a physical examination confirmed that these hair patterns are normal. However, I learned that both of my testicles measure approximately 10 cc, which is below the reference range.

My body mass index (BMI) is 38, indicating obesity. During my visit, visual field testing returned normal results. I am now awaiting additional diagnostic tests to determine the underlying cause of my symptoms.",A. Karyotype analysis B. Sleep study C. Semen analysis D. Abdominal ultrasound E. Serum cortisol measurement F. MRI of the pituitary G. Bone density scan H. Genetic testing for Klinefelter syndrome I. Dynamic pituitary hormone testing J. Testicular ultrasound,B,Sleep study,neutral,"Your symptoms, including persistent fatigue, decreased libido, infrequent morning erections, and mild erections during masturbation, along with the finding of smaller testicle size, suggest a potential hormonal imbalance, possibly related to low testosterone levels. The obesity (BMI of 38) can also contribute to hormonal changes and may exacerbate these symptoms. 

The normal visual field testing is reassuring, as it helps rule out pituitary issues that could affect hormone levels. It's important to await the results of your additional diagnostic tests, which may include hormone panels (like testosterone, LH, FSH) and possibly imaging studies to assess the pituitary gland or other factors. Addressing lifestyle factors, such as weight management, can also be beneficial in improving your symptoms.",Sleep study,False,True,False,False,False
107,"I am a 45-year-old male who recently visited the clinic for an evaluation of my dyslipidemia. A week prior, I had a fasting lipid panel that indicated elevated triglycerides, although I am currently asymptomatic. My medical history includes an aortic valve replacement and type II diabetes mellitus. I take several medications, including aspirin, warfarin, regular insulin, and atorvastatin. 

During the visit, my vital signs were measured: my temperature was 37.0°C, pulse was 90 beats per minute, respirations were 17 per minute, and blood pressure was 125/80 mmHg. The physical examination showed no abnormalities. My healthcare provider informed me that my INR was 1.5, and my serum creatinine was 1.2 mg/dL. 

The provider discussed starting fenofibrate therapy to manage my triglyceride levels. I was informed that an intervention should be implemented before beginning this new medication. I understand the importance of monitoring my health closely, especially given my background and current treatment regimen.",A. Obtain baseline thyroid function tests B. Obtain gallbladder ultrasound C. Monitor blood glucose levels more frequently D. Obtain liver function test E. Increase aspirin dosage F. Decrease the warfarin dose G. Measure serum creatinine phosphokinase level H. Discontinue atorvastatin I. Check fasting lipid profile again J. Obtain renal function panel,F,Decrease the warfarin dose,neutral,"Before starting fenofibrate therapy, it is essential to assess your renal function more closely, particularly because fenofibrate can increase the risk of myopathy and rhabdomyolysis, especially in patients taking statins like atorvastatin. Given your serum creatinine level of 1.2 mg/dL, your healthcare provider may want to ensure that your renal function is stable and consider adjusting your atorvastatin dosage if necessary. Additionally, monitoring your lipid levels and INR after starting fenofibrate will be important to ensure safety and efficacy.",Decrease the warfarin dose,False,False,False,False,True
108,"I am a 1-month-old male infant who was evaluated for feeding difficulties that have persisted for the past 10 days. During feeds, I experienced respiratory distress and sweating. I was delivered vaginally at 38 weeks, and there were no health issues noted before this evaluation. My birth measurements were 51 cm in length and 3660 g in weight. My initial Apgar scores were 8 and 9, and I was discharged from the hospital two days after birth since my examination was unremarkable.

During my current evaluation, it was noted that my growth is at the 20th percentile for length and the 10th percentile for weight. My vital signs included a temperature of 36°C, a heart rate of 190 beats per minute, a respiratory rate of 60 breaths per minute, and a blood pressure of 70/50 mm Hg. While my oxygen saturation in room air was 96%, I was found to be breathing laboriously. 

The physical examination revealed a grade 2/6 holosystolic murmur at the left lower sternal border, but there was no cyanosis. An ECG indicated left-axis deviation, and a chest x-ray showed enlargement of the left atrium and ventricle with increased pulmonary vascularity. Doppler echocardiography confirmed the presence of an intracardiac shunt.",A. Closure of the ductus arteriosus B. Increase in systemic vascular resistance C. Left ventricular outflow tract obstruction D. Development of pulmonary venous congestion E. Increased left-to-right shunting due to septal defect enlargement F. Decreased systemic cardiac output G. Failure of physiologic cardiac remodeling H. Decrease in pulmonary vascular resistance I. Progressive right ventricular hypertrophy J. Persistent pulmonary hypertension,H,Decrease in pulmonary vascular resistance,neutral,"The clinical presentation and findings suggest that the infant is likely suffering from a congenital heart defect, specifically a ventricular septal defect (VSD) or possibly an atrioventricular septal defect (AVSD). The holosystolic murmur, respiratory distress during feeding, and signs of heart failure (e.g., tachycardia, poor weight gain) indicate increased pulmonary blood flow due to an intracardiac shunt. The left atrial and ventricular enlargement on chest x-ray further supports this diagnosis. Immediate evaluation and management by a pediatric cardiologist are warranted.",Decrease in pulmonary vascular resistance,False,True,False,False,True
109,"I am a 32-year-old woman who recently experienced right-sided lower back pain. The discomfort began a few days ago, although I am not entirely sure when it started; I suspect it may have begun after waking up one morning. The pain is localized to my lower back and does not radiate to other areas.

I have a medical history that includes two pregnancies. I delivered my second child via normal spontaneous vaginal delivery about a year ago. At present, I do not have any additional symptoms accompanying the back pain.

During a recent examination, it was noted that my right sacral sulcus is shallow, and the right inferior lateral angle is positioned superiorly. There is tenderness in my lower lumbar paraspinal muscles on both sides, and a seated flexion test was positive on the left side. With these observations, I have been informed that there are several possible diagnoses to consider regarding my condition.",A. Bilateral sacral flexion about the middle transverse axis B. Left-on-left sacral torsion C. Right unilateral sacral flexion about the middle transverse axis D. Left unilateral sacral flexion about the superior transverse axis E. Right unilateral sacral extension about the superior transverse axis F. Left sacral rotation on a right oblique axis G. Right unilateral sacral flexion about the superior transverse axis H. Left unilateral sacral extension about the middle transverse axis I. Right-on-left sacral torsion J. Left unilateral sacral flexion about the middle transverse axis,J,Left unilateral sacral flexion about the middle transverse axis,neutral,"Based on your symptoms and examination findings, it is possible that you are experiencing a musculoskeletal issue, such as a sacroiliac joint dysfunction or lumbar strain. The tenderness in the paraspinal muscles and the positive seated flexion test suggest a potential asymmetry or dysfunction in the pelvic or lumbar region. Given your recent pregnancy and delivery, changes in your body mechanics and muscle tone could also contribute to this pain. It would be advisable to follow up with a healthcare provider for a tailored treatment plan, which may include physical therapy, exercises, or other interventions to address the underlying issues.",Left unilateral sacral flexion about the middle transverse axis,False,True,True,False,True
110,"I am a 27-year-old woman with no significant medical history. Recently, I visited the clinic due to upper back pain that I have been experiencing, which seems to worsen when I study for extended periods. The pain is achy and is located in my upper back, rated at a 7 out of 10 in intensity. 

During my examination, the healthcare provider assessed my upper extremity strength and range of motion, both of which were normal on both sides. However, there was a localized area of tenderness identified on the left side of my back. This tenderness was specifically at the posterolateral aspect of the transverse process, just medial to the inferior angle of my scapula. 

The pain and its location led to a discussion about potential diagnoses, as the provider considered various options based on my symptoms and the physical examination findings. I left the appointment with a better understanding of my condition and next steps for management.",A. Serratus posterior superior strain B. Rhomboid major muscle spasm C. T7 posterior tender point D. Latissimus dorsi muscle strain E. Scapulothoracic bursitis F. T6 posterior tender point G. T12 posterior tender point H. T8 posterior tender point I. Myofascial pain syndrome involving the trapezius J. T9 posterior tender point,H,T8 posterior tender point,neutral,"Based on your symptoms and examination findings, it sounds like you may be experiencing a musculoskeletal issue, possibly related to muscle strain or myofascial pain syndrome, particularly given the localized tenderness near the transverse process and the exacerbation of pain with prolonged study. This type of pain is often associated with poor posture or prolonged static positions. 

Management typically includes physical therapy focusing on posture correction, stretching, and strengthening exercises, as well as pain relief strategies such as NSAIDs or heat therapy. If symptoms persist, further evaluation, such as imaging, may be warranted to rule out any underlying structural issues.",T8 posterior tender point,False,True,False,False,True
111,"I am a 39-year-old male with a history of heroin use disorder, for which I am currently receiving methadone treatment. Recently, I noticed a progressive swelling in my lower extremities that has persisted for the past two weeks. Alongside this, I have been experiencing fatigue and hematuria. I maintain a stable monogamous relationship and do not use any substances other than methadone.

During a physical examination, the doctor noted several findings, including conjunctival pallor, scleral icterus, and hepatomegaly. I also had noticeable acrocyanosis and 2+ pitting edema in my lower legs. My vital signs indicated mild hypertension, with a reading of 152/98 mmHg. 

The urinalysis showed proteinuria with dysmorphic red blood cells, and there were decreased levels of C3 and C4 complement in my blood tests. Given these symptoms and findings, I understand that there are various potential outcomes associated with renal biopsy results.","A. Membranoproliferative pattern with double contours B. Diffuse mesangial cell proliferation with capillary wall thickening C. Crescentic glomerulonephritis with fibrinoid necrosis D. Granular subepithelial immune deposits (""spike and dome"" appearance) E. Focal segmental glomerulosclerosis with podocyte effacement F. Nodular mesangial expansion with Kimmelstiel-Wilson lesions G. Linear IgG deposits along glomerular basement membrane H. Glomerular basement membrane thinning and splitting I. Apple-green birefringence on Congo red stain J. Wire loop lesions with hyaline thrombi",B,Diffuse mesangial cell proliferation with capillary wall thickening,neutral,"Based on your symptoms and findings, you may be experiencing a nephritic syndrome, likely related to an underlying condition such as a glomerulonephritis. The presence of hematuria, proteinuria, dysmorphic red blood cells, and decreased complement levels (C3 and C4) suggests a possible immune-mediated process, such as lupus nephritis or another type of glomerular disease.

The conjunctival pallor and scleral icterus indicate anemia and possible liver involvement, which could be related to systemic disease. The hypertension and lower extremity edema further support renal involvement.

A renal biopsy will be crucial in determining the specific type of glomerulonephritis and guiding treatment. Potential outcomes of the biopsy could include findings consistent",Diffuse mesangial cell proliferation with capillary wall thickening,False,True,False,False,True
